"AJLPGS:18072";"Opérations d’urbanisme et corruption dans le District de Bamako : cas des opérations de lotissement dans la commune VI";"Vol 3, No 1: March 2020, Special Issue 2 on Land Policy in Africa";"Notre article porte sur les pratiques de corruption liées aux opérations de lotissement dans le District de Bamako, plus précisément dans la commune VI. Notre démarche a consisté dans un premier temps, à faire une analyse des textes législatifs sur le foncier au Mali, dans un deuxième temps, à réaliser des enquêtes de terrain auprès des acteurs impliqués dans une opération de lotissement. L’analyse des données recueillies nous a permis de nous rendre compte que tous les acteurs impliqués, notamment les autorités politico-administratives et les demandeurs, développent des pratiques de corruption que nous avons regroupées en trois grandes formes : Octroi de parcelles aux autorités et responsables impliqués, enveloppe pour ces mêmes autorités et frais de cola ou de transport pour les agents intermédiaires. Nous avons retenu que ces pratiques ont pour conséquences l’insécurité foncière, le renchérissement des prix des parcelles et la mauvaise viabilisation de cadre de vie.";"Koumaré, Mamadou
Université des Sciences Sociales et de Gestion de Bamako";"";"African Journal on Land Policy and Geospatial Sciences";"African Journal on Land Policy and Geospatial Sciences";"2020-03-31";"fr";"corruption;land;urbanization";"Land & Corruption;Urban Tenure";"MLI";"Peer-reviewed publication";"https://doi.org/10.48346/IMIST.PRSM/ajlp-gs.v3i1.18072";"https://revues.imist.ma/index.php/AJLP-GS/article/view/18072/11004";"";"CC-BY-NC-SA";"Copyright (c) 2020 African Journal on Land Policy and Geospatial Sciences";"10";"lotissement, urbanisation, opération d’urbanisme, pratiques de corruption, foncier.";""
"AJLPGS:16334";"Recours aux satellites pour appuyer le management de l’eau d’irrigation:   Estimation des besoins en eau des agrumes par télédétection dans la Plaine de Triffa-Berkane (Maroc)";"Vol 2, No 2: May 2019";"Les agrumes représentent la première culture irriguée dans la plaine de Trifa (Berkane, Maroc) avec une superficie en extension continue. Ceci accentue les pressions sur les ressources en eau déjà limitées dans la région. De ce fait, une gouvernance efficace et rationnelle de l’eau agricole s’impose. Dans ce travail, nous proposons une approche basée sur les observations satellitaires pour appuyer la gestion de l’eau d’irrigation consommée par les surfaces agrumicoles. Cette approche est scindée en deux étapes : des cartes de coefficient cultural d’agrumes ont été d’abord établies à partir d’une cartographie d’agrumes stratifiés selon l’âge, dérivée à partir des images satellitaires Sentinel optique et radar. Ensuite, une implémentation validée du modèle de Hargreaves a permis l’estimation de l’évapotranspiration potentielle à partir des images thermiques du capteur TIRS du Landsat 8. Comparé au modèle de référence de Penman-Montheith, une erreur (RMSE) inférieure à 0.5mm/jour est enregistrée. Finalement, le croisement des cartes du coefficient cultural et de l’évapotranspiration potentielle a permis de spatialiser l’évapotranspiration maximale des agrumes à l’échelle du pixel de la taille d’un hectare. Ces informations pourraient être intelligemment converties en services de pilotage assisté de l’irrigation pour une meilleure productivité de l’eau agricole.";"Hadria, Rachid
Elmansouri, Loubna
Benabdelouahab, Tarik
Ouatiki, Hamza
Lebrini, Youssef
Htitiou, Abdelaziz
Khellouk, Rida";"Government of Morocco";"African Journal on Land Policy and Geospatial Sciences";"African Journal on Land Policy and Geospatial Sciences";"2019-05-31";"fr";"";"";"MAR";"Peer-reviewed publication";"https://doi.org/10.48346/IMIST.PRSM/ajlp-gs.v2i2.16334";"https://revues.imist.ma/index.php/AJLP-GS/article/view/16334/9224";"";"CC-BY-NC-SA";"Copyright (c) 2019 African Journal on Land Policy and Geospatial Sciences";"14";"Évapotranspiration, agrumes, télédétection, Landsat, Sentinel, Trifa, Maroc";""
"AJLPGS:21356";"Gender Equality in Ownership of Agricultural Land in Rural Tanzania: Does Matrilineal Tenure System Matter?";"Vol 3, No 3: September 2020";"Gender gap in ownership of agricultural land is still wide in many developing countries, mainly in favour of men. In some of these countries, both patrilineal and matrilineal systems are practised and recognized by governments. Tanzania is one of the countries in which both systems are practised. This paper explores the extent of gender equality in ownership of agricultural land in Kisarawe and Mkuranga districts which are typical rural agricultural settings and mainly matrilineal societies in Tanzania. It also attempts to examine women’s benefits from agricultural activities. Respondents were randomly selected from village registers of the six villages studied. The findings contradict the conventional narratives of gender inequality that women are discriminated in land ownership. Despite insignificant percentage of societies which embrace matrilineal system in Tanzania, to a large extent the system seems to support women in owning land in those societies. However, a few elements of gender discrimination were noted especially for widows and divorced women. The findings make a case for more intervention in ensuring statutory and customary land tenure practices are complimentary in enhancing gender equality in accessing land especially in rural areas. ";"Kongela, Sophia Marcian
SIDA- Ardhi University (ARU) Research Cooperation Programme";"";"African Journal on Land Policy and Geospatial Sciences";"African Journal on Land Policy and Geospatial Sciences";"2020-09-28";"en";"land access;land ownership;land tenure;land tenure systems";"Indigenous & Community Land Rights";"TZA";"Peer-reviewed publication";"https://doi.org/10.48346/IMIST.PRSM/ajlp-gs.v3i3.21356";"https://revues.imist.ma/index.php/AJLP-GS/article/view/21356/12130";"";"CC-BY-NC-SA";"Copyright (c) 2020 African Journal on Land Policy and Geospatial Sciences";"15";"Gender equality, access to land, land ownership, land tenure, Tanzania";""
"AJLPGS:13370";"LAND REFORM IN THE CONTEXT OF DEVOLUTION:  LESSONS FROM KAJIADO COUNTY, KENYA";"Vol 1, No 2: September 2018, Special Issue on Youth and Land Governance";"Kenya’s development context is greatly influenced by land use and ownership. Consequently land holds immense cultural, spiritual and socio-political significance for nearly all communities. However, proper utilization of land has been besmirched by numerous challenges. Vulnerable and marginalized groups such as women, children and youth have borne the brunt of land challenges. The Constitution of Kenya, 2010 in appreciation of these complex dynamics has sought to provide a blue print for the realization of land reforms. It is in this regard, that the County Government of Kajiado drawing on its devolved mandate undertook key land reform measures. Applying the criteria of subsidiarity and consensus, Kajiado County realized homegrown policy solution to land challenges. Alongside, useful lessons worth learning such as the importance of harnessing local political capital; involvement of diverse community voices; creation of spaces to entrench global good practice as well as working with and through legitimate structures emerged.";"Komba, Everlyne
Odary, Kenneth Victor
Letura, Ali";"";"African Journal on Land Policy and Geospatial Sciences";"African Journal on Land Policy and Geospatial Sciences";"2018-09-30";"en";"land;land policies;land reform";"Land Stakeholders & Institutions;Socio-Economic & Institutional Context";"KEN";"Peer-reviewed publication";"https://doi.org/10.48346/IMIST.PRSM/ajlp-gs.v1i2.13370";"https://revues.imist.ma/index.php/AJLP-GS/article/view/13370/7738";"";"CC-BY-NC-SA";"Copyright (c) 2018 African Journal on Land Policy and Geospatial Sciences";"10";"Devolution; Land; Reform; Kajiado; Policy; Odary; Komba";""
"AJLPGS:17724";"Dynamiques spatio-temporelles des villes secondaires au senegal : les cas de Médina Gounass et de Diaobé en Haute Casamance de 1965 à 2018";"Vol 3, No 2: May 2020";"L’urbanisation des campagnes africaines pose le problème de l’avenir des paysages agraires situés à la périphérie des villes. Au Sénégal comme dans la plupart des villes ouest-africaines, ces espaces connaissent une recomposition spatiale liée à l’extension urbaine. Cette étude analyse les dynamiques spatio-temporelles de 1965 à 2018 dans des villes secondaires du Sénégal, mais assez dynamiques : Médina Gounass et Diaobé situées au sud du Sénégal. Les enquêtes de terrain et les entretiens réalisés avec des personnes ressources (responsables de structures et organisations paysannes) ont permis d’apprécier la dégradation de l’environnement à travers un changement dans les usages du sol. Les images de corona 1965, de Landsat 1999, de Google Earth 2012 et de Bing Map 2018 sont utilisées pour analyser l’évolution des faciès d’occupation du sol dans ces deux localités. La cartographie a montré que les zones de cultures pluviales ont été partout rattrapées par le front urbain. Cette urbanisation est fortement liée à une pression foncière intervenant dans un contexte de communalisation intégrale avec la loi n° 2013-10 du 28 décembre 2013, galvaudant les projets d’extension de la ville. Le développement urbain durable est devenu un axe important sur les agendas politiques en réponse à la problématique urbaine.";"MBALLO, Issa
SY, Oumar
Mairie de Médina Yéro Foulah, Marie de Diaobé, Laboratoire de Géomatique et d'Environnement";"";"African Journal on Land Policy and Geospatial Sciences";"African Journal on Land Policy and Geospatial Sciences";"2020-05-31";"fr";"";"";"SEN";"Peer-reviewed publication";"https://doi.org/10.48346/IMIST.PRSM/ajlp-gs.v3i2.17724";"https://revues.imist.ma/index.php/AJLP-GS/article/view/17724/11516";"";"CC-BY-NC-SA";"Copyright (c) 2020 African Journal on Land Policy and Geospatial Sciences";"13";"Dynamiques spatio-temporelles;paysages urbains;recomposition spatiale;Haute Casamance;Sénégal";""
"AJLPGS:17806";"ACCES A LA PROPRIETE FONCIERE ET MISE EN VALEUR DURABLE DES TERRES EN PAYS BAMUM AU CAMEROUN";"Vol 3, No 1: January 2020, Special Issue 1 on Land Policy in Africa";"Le pays Bamum est un territoire de la région de l’Ouest Cameroun  fondé au XIVe siècle par le roi Nchare. C’est un royaume où le Sultan est le dépositaire des terres. Les allochtones acquièrent le plus souvent  des  terres auprès des autochtones pour exploitation. Les autochtones n’ont qu’un droit d’usufruitsur les terre qui leurs sont cédées, mais aucun droit de disposer sur celles-ci. Ainsi, les tentatives d’immatriculation de ces terrains se heurtent très souvent au véto des autochtones du fait qu’ils n’ont pas le droit de sécuriser les terres dans un territoire étranger. Cette situation conflictuelle favorise la corruption afin d’obtenir une autorisation d’immatriculation de la terre, sans laquelle aucun investissement n’est durable. La mauvaise gouvernance foncière et les inégalités des droits d’accès des femmes à la terre renforcent l’insécurité foncière et une mise en valeur mitigée des terres en pays Bamun. L’objectif de cet article est donc de montrer le processus d’accès à la propriété foncière et les contraintes liées à la mise en valeur durable des terres en pays Bamum. L’étude s’appuie sur une recherche documentaire, les observations participantes, les entretiens auprès des personnes ressources, et les enquêtes sociales. Il en ressort que la précarité foncière en pays Bamum constitue une menace grave pour la mise en valeur durable des terres.";"Mopi Touoyem, Fabrice
CLPA 2019 Organizers";"";"African Journal on Land Policy and Geospatial Sciences";"African Journal on Land Policy and Geospatial Sciences";"2020-01-31";"fr";"land;land ownership";"";"CMR";"Peer-reviewed publication";"https://doi.org/10.48346/IMIST.PRSM/ajlp-gs.v3i1.17806";"https://revues.imist.ma/index.php/AJLP-GS/article/downloadSuppFile/17806/2651";"";"CC-BY-NC-SA";"Copyright (c) 2020 African Journal on Land Policy and Geospatial Sciences";"13";"Propriété foncière, mise en valeur, terres, pays Bamum, Cameroun";""
"AJLPGS:14743";"MODÈLE D’ONTOLOGIE ET THÉSAURUS POUR LA GOUVERNANCE DU DOMAINE FONCIER MAROCAIN";"Vol 2, No 2: May 2019";"Comme tout domaine vital, le domaine d’administration du foncier est un univers de discours peuplé par des termes et des concepts dont le sens et la sémantique forment un système de connaissances. L’organisation de ces connaissances est un préalable à la gestion des données foncières et accessible grâce aux technologies du web sémantique. Il en résulte un système d’organisation des connaissances foncières, suivant un modèle de domaine d’ontologie appuyé par un thésaurus.Les concepts du domaine d’administration du foncier portent sur les multiples aspects concrets et abstraits du foncier : le domaine lui-même, l’intervenant, le bien foncier, le droit de propriété, la source juridique ou technique ou administrative de l’information foncière, l’objet de droit de propriété, le levé et la représentation de la propriété  foncière, etc. Ces concepts sont liés entre eux et sont soumis à des règles et des contraintes, en plus ils ont des instances effectives identifiables dans le monde réel les cas échéants.L’effort de gouvernance du foncier et les décisions des politiques foncières sont lourdement influencés par la qualité de la gestion des connaissances du domaine en question. Il s’impose par conséquent la nécessité de mobilisation des intervenants institutionnels et spécialisés du domaine pour la mise en place d’un système moderne d’organisation des connaissances foncières. Un tel system se doit de respecter les standards internationaux, et ce en échange des silos d’informations formés et utilisés dans chacun des multiples sous domaine foncier.C’est dans cette optique que vient cet article pour présenter les éléments d’un modèle d’ontologie et d’un thesaurus conformes aux standards internationaux en vigueur.";"ADAD, MOULAY ABDESLAM
SEMLALI, EL HASSANE
EL AYACHI, MOHA
IBANNAIN, FATIHA";"";"African Journal on Land Policy and Geospatial Sciences";"African Journal on Land Policy and Geospatial Sciences";"2019-05-31";"fr";"land";"";"MAR";"Peer-reviewed publication";"https://doi.org/10.48346/IMIST.PRSM/ajlp-gs.v2i2.14743";"https://revues.imist.ma/index.php/AJLP-GS/article/view/14743/9225";"";"CC-BY-NC-SA";"Copyright (c) 2019 African Journal on Land Policy and Geospatial Sciences";"23";"Ontologie, SKOS, OWL, RDFs, Thesaurus, Web Sémantique, Modèle, Foncier,  Maroc";""
"AJLPGS:20011";"Gender Inequality and Climate Change Adaptation Strategies for Food Security in Tanzania";"Vol 3, No 3: September 2020";"This paper assessed gender inequality in household resources, particularly land ownership, division of labour and decision making as regards climate change adaptation strategies for household food security. The results show that gender inequality exists among the pastoralists in terms of household division of labour, ownership of resources and decision-making such that women do not control important productive resources such as land and livestock which make them more vulnerable to the impacts of climate change and less able to adapt to it. The pastoralists use various adaptation strategies including crop farming, selling animals, migration and fencing reserve pasture. The paper concludes that gender inequality renders women more vulnerable to climate change impact because most adaptation activities that have immediate effect on food security are done by women and the burden to feed the household has shifted more to women and exacerbating food insecurity. The paper recommends that in addition to spontaneous climate change adaptation strategies used by the pastoralist the government should provide planned adaptations such as early warning systems, rainwater harvesting and the use of drought-resistant crops because many pastoralists have adopted crop farming as one of their climate change adaptations in ensuring food security. Also, sectoral policies and particularly land policy should be gender sensitive with clear strategies to address inequalities in the household division of labour, decision-making and ownership of resources especially land so as to lessen women’s vulnerability to climate change impact and food insecurity.";"Edward, Mamkwe Claudia
OSSREA";"";"African Journal on Land Policy and Geospatial Sciences";"African Journal on Land Policy and Geospatial Sciences";"2020-09-28";"en";"climate change;food security;gender equity;land ownership";"Land & Food Security;Land & Gender;Land, Climate Change & Environment";"TZA";"Peer-reviewed publication";"https://doi.org/10.48346/IMIST.PRSM/ajlp-gs.v3i3.20011";"https://revues.imist.ma/index.php/AJLP-GS/article/view/20011/12204";"";"CC-BY-NC-SA";"Copyright (c) 2020 African Journal on Land Policy and Geospatial Sciences";"12";"Land ownership; climate change; adaptation strategies; food security; gender inequality";""
"AJLPGS:12406";"The Estimation of theoretical accuracy of mobile terrestrial LiDAR";"Vol 1, No 1: May 2018";"Mobile Terrestrial LiDAR (Light Detecting And Ranging) (MTL) is a new technology adapted to increasing need of 3D geo-referenced data. The system requires an integration of laser scanners with other sensors of navigation such as GPS and INS and inertial measurement unit. This fusion allows direct georeferencing of point cloud data. As well as the practical accuracy, the theoretical accuracy of raw data also deals with the investors in the mobile mapping systems. This study evaluates the theoretical accuracy of point clouds produced by MTL system through the error propagation theory. The accuracy estimation implies a description of sensors integration, synchronization and calibration. In addition, this paper presents models of reference transformation. The results of this study show that the MTL data accuracy depends on several parameters. Among these parameters, the range is the most critical one.";"Ait EL Kadi, Kenza
Ouaziz, Mohamed";"";"African Journal on Land Policy and Geospatial Sciences";"African Journal on Land Policy and Geospatial Sciences";"2018-05-31";"en";"";"";"002";"Peer-reviewed publication";"https://doi.org/10.48346/IMIST.PRSM/ajlp-gs.v1i1.12406";"https://revues.imist.ma/index.php/AJLP-GS/article/view/12406/6948";"";"CC-BY-NC-SA";"Copyright (c) 2018 African Journal of Geospatial Sciences and Land Governance";"15";"Mobile Terrestrial LiDAR, theoretical accuracy, calibration, synchronization, error;LiDAR terrestre mobile, précision théorique, calibration, synchronisation, Propagation";""
"AJLPGS:18316";"Assessing the challanges of women's land rights in Tanznia";"Vol 3, No 1: March 2020, Special Issue 2 on Land Policy in Africa";"The purpose of this study is to explore the challenges of women on land rights, in Tanzania customary practices often required woman to access land through their fathers, brothers, husbands or other men who control the land, so this makes women vulnerable and decreases agricultural productivity. When women loses their connection to this male relative, either through death, divorce or migration, they can lose their land, home and means of supporting themselves and their families. The methodology adopted in this study involved a review of secondary sources such as land act, Village Land Act (both passed in 1999) ,National Land policy 1995 of Tanzania,  interview and analysis that explain on the rights human have on land in both rural and urban areas ,and finaly the paper concludes on the way forward to eradicate women's challenges on land rights. Strengthening women's land rights there is need to promote efficiency and effectively policies and framework which will favour women rights on land because the majority of the people in Tanzania today rely on land for their livelihood. Secure land rights confer direct economic benefits because land is a key input into agriculture production and enterprise development: can be used as a source of income from rental or sale; and can provide collateral for credit where strong, well-regulated land markets and credit infrastructure exist. Tanzania has an ambitious agenda for land and natural resource policy and legal reform. Since 1999 it has been transitioning to a legal framework that integrates aspects of customary tenure, supports the rights of women, recognizes private property rights, and permits individualized control of resources in farming areas. Despite positive developments, the agenda of policy and legal reform is not yet complete. Some claim that the current legal framework fails to effectively provide the foundation for an effective land governance system. While the legal framework generally upholds women’s rights to land, in rural areas practices predominate whereby men are heads of households and have greater rights to land than women. The law is still weak in regard to women’s inheritance rights to land, and inheritance practices discriminate severely against women.";"KIVARIA, AMINA KIMANGANO
Institute of lands Dar es Salaam, Ardhi University, DAAD, NELGA";"";"African Journal on Land Policy and Geospatial Sciences";"African Journal on Land Policy and Geospatial Sciences";"2020-03-31";"en";"land governance;land policies;land rights;land tenure;women";"Indigenous & Community Land Rights;Land & Gender;Land Stakeholders & Institutions;Socio-Economic & Institutional Context";"002";"Peer-reviewed publication";"https://doi.org/10.48346/IMIST.PRSM/ajlp-gs.v3i1.18316";"https://revues.imist.ma/index.php/AJLP-GS/article/view/18316/11032";"";"CC-BY-NC-SA";"Copyright (c) 2020 African Journal on Land Policy and Geospatial Sciences";"9";"Gender;land right;land policies;governance of tenure";""
"AJLPGS:14246";"Petit périmètre irrigué villageois : Un atout de gestion intégrée des ressources en eau dans le bassin Chari-Logone au Tchad";"Vol 1, No 3: December 2018";"The irrigation process is old and its dynamic has moved towards the promotion of small village irrigated areas where the involvement of producer’s production is more important. The establishment of business management and supervision entities has been a success. But their sustainable operation has not lived up to expectations by the low capitalization of local competence. The study addresses the question of sustainability of agricultural development in the Sahel. The aim is to contribute to the integrated water resources management process though an understanding the implication of the collective management of these infrastructures. The work was based on a situational diagnosis (physical and social) though open survey and interviews as well as documentary data on the structure developed. Management difficulties have affected equipment maintenance as well as the organization of the actors. However, this experience remains to be capitalized.";"Borgoto, DAOUD
Dr BANI Grégoire, Directeur Général du PRASAC, CEMAC (www.prasac-cemac.org)";"";"African Journal on Land Policy and Geospatial Sciences";"African Journal on Land Policy and Geospatial Sciences";"2018-12-31";"fr";"sustainable development";"Socio-Economic & Institutional Context";"TCD";"Peer-reviewed publication";"https://doi.org/10.48346/IMIST.PRSM/ajlp-gs.v1i3.14246";"https://revues.imist.ma/index.php/AJLP-GS/article/view/14246/8173";"";"CC-BY-NC-SA";"Copyright (c) 2018 African Journal on Land Policy and Geospatial Sciences";"18";"irrigated areas, management, Chad, sustainable development";""
