"AJLPGS:23884";"LAND BASED FINANCE FOR SUSTAINABLE URBAN DEVELOPMENT IN AFRICA: CHALLENGES AND PROSPECTS";"Vol 3: Special Issue 3, 2020";"As African cities expand so does the pressure to improve infrastructure and extend key public services for the growing urban populations. With limited tax receipts, local governments are struggling to finance new urban development or even maintain existing infrastructure. As land has inherent advantages in generating revenue, Land-based financing (LBF) is being seriously considered or piloted as an innovative and additional source for enhancing budgets for infrastructure projects, public services and wider sustainable development. However, the potential and limitations of implementing LBF in African socio-economic and political contexts have been under-researched. LBF feasibility depends on efficiency of several systems such as land rights, land markets, planning process, valuation protocols, local economic strategies and stakeholder involvement as part of a wider functional land governance framework. Based on emerging literature review and assessment of the policy discourse, this article critically explores the Responsible Land Administration (RLA) principles, professional practices and technical capacities that could facilitate the deployment of LBF instruments to invigorate smart, prosperous, fair and inclusive African cities.";"SAIT, Siraj";"";"African Journal on Land Policy and Geospatial Sciences";"African Journal on Land Policy and Geospatial Sciences";"2020-11-30";"en";"development;infrastructure";"";"002";"Peer-reviewed publication";"https://doi.org/10.48346/IMIST.PRSM/ajlp-gs.v3i3.23884";"https://revues.imist.ma/index.php/AJLP-GS/article/view/23884/12671";"";"CC-BY-NC-SA";"Copyright (c) 2020 African Journal on Land Policy and Geospatial Sciences";"18";"Land Based Financing; Responsible Land Administration; Sustainable Urban Development; Infrastructure; Municipal";""
"AJLPGS:13393";"The Implication Of Social Policies in Enhancing Equality in Peri-Urban Land Market in Bagamoyo District, Tanzania";"Vol 1, No 2: September 2018, Special Issue on Youth and Land Governance";" Population increase influence the dynamics in land market and agitate land access competition, which results into exclusion of some individuals. Inequality is evident in majority of Tanzanians women, youth, children and elderly. It is more prevalence in land markets where rich individuals are favorable to make choices regarding access to land resources. Owing to potential developments, peri-urban areas are becoming places where changes in land uses and activities take place. This study analyzed how gender policy facilitated access to land market by the disadvantaged poor in Bagamoyo District. It was evident that disadvantaged poor was the most affected group in accessing land markets. Nevertheless, enforcement of Gender policy has a positive influence to the disadvantaged poor. For stance it has facilitated, the district to contribute 20% off its budget towards disadvantaged groups’ investment capital. Therefore, more emphasis on gender policy implementation is needed to enhance equal access to land markets.";"Babere, Nelly John";"African Land Policy Centre;The Network of Excellence on Land Governance in Africa;United Nations Economic Commission for Africa";"African Journal on Land Policy and Geospatial Sciences";"African Journal on Land Policy and Geospatial Sciences";"2018-09-30";"en";"land markets;periurban areas;urban land;women";"Land & Gender;Land & Investments;Land Stakeholders & Institutions;Socio-Economic & Institutional Context;Urban Tenure";"TZA";"Peer-reviewed publication";"https://doi.org/10.48346/IMIST.PRSM/ajlp-gs.v1i2.13393";"https://revues.imist.ma/index.php/AJLP-GS/article/view/13393/7742";"";"CC-BY-NC-SA";"Copyright (c) 2018 African Journal on Land Policy and Geospatial Sciences";"12";"Peri urban areas; Social Policy; Gender; Inequality; Land Markets";""
"AJLPGS:18335";"Améliorer le système d'expropriation et de compensation dans un contexte de pluralisme juridique: Leçons du Camerou";"Vol 3, No 1: March 2020, Special Issue 2 on Land Policy in Africa";"Cameroon is currently witnessing an unprecedented wave of land-based investments, ranging from natural resources exploitation (oil, mining and gas), logging, large infrastructure building, etc. These developments happen in a context of population growth, in an increase in the domestic demand for land. There is a gap between the legislation governing expropriation and compensation in the country, and the variety of customary rules on land and resources. This context of legal pluralism results into endless conflicts opposing communities and the investors, including the State. A thorough analysis of the legislation reveals a series of weaknesses, and the on-going land reform in Cameroon offers a unique opportunity for an in-depth revision of the rules governing expropriation, in order to ensure a better protection of communities’ rights. This study indicated paths for the reform, in terms of improvements of the quality of information granted to potentially affected communities, in the composition and mandate of the commission identifying the victims and damages, and in the scope of compensation and modalities of payment.  ";"Nguiffo, Samuel A.";"European Union";"African Journal on Land Policy and Geospatial Sciences";"African Journal on Land Policy and Geospatial Sciences";"2020-03-31";"fr";"compensation;dispossession;expropriation";"Land Conflicts";"002";"Peer-reviewed publication";"https://doi.org/10.48346/IMIST.PRSM/ajlp-gs.v3i1.18335";"https://revues.imist.ma/index.php/AJLP-GS/article/view/18335/11002";"";"CC-BY-NC-SA";"Copyright (c) 2020 African Journal on Land Policy and Geospatial Sciences";"15";"Expropriation; compensation; land-based investments;";""
"AJLPGS:17924";"Analysis of Factors influencing Vulnerability of Fishing Systems to Climate Change among Artisanal Fisher-folks in Coastal area of Lagos, Nigeria";"Vol 3, No 1: January 2020, Special Issue 1 on Land Policy in Africa";"Climate change poses serious challenges to the sustainability of fisheries and aquaculture systems, with severe implications for the majority people who depend on them largely for their livelihoods. Therefore, this study investigates factors influencing the vulnerability of fishing activities to climate change among artisanal fisher-folks in coastal area of Lagos, Nigeria. A three-stage random sampling technique was used to select 342 artisanal fishers from the study area. Data were collected with the aid of structured questionnaire and subjected to factor analysis and descriptive statistics. The results of data analysis revealed that artisanal fishers are vulnerable to external shocks (climate change) due to their high reliance on fishing activities with occupational pluralism being considered as risk-reduction mechanism. Factor analysis revealed that socioeconomic, occupational activities, social cohesion/organization, and market opportunities and biodiversity conservation policy factors among fishers, with Eigen values of 2.2532, 1.5713, 1.3314, and 1.1024 respectively, accounted for their vulnerability to change in climate. The study recommends proper sensitization and capacity building among the coastal fishers on the threats of climate change to their fishing activities.";"Daudu, Abdulrazaq Kamal
Oladipo, Felix Olayinka
Olatinwo, Latifat Kehinde
Kareem, Waheed Oyedola";"";"African Journal on Land Policy and Geospatial Sciences";"African Journal on Land Policy and Geospatial Sciences";"2020-01-31";"en";"climate change";"Land, Climate Change & Environment";"NGA";"Peer-reviewed publication";"https://doi.org/10.48346/IMIST.PRSM/ajlp-gs.v3i1.17924";"https://revues.imist.ma/index.php/AJLP-GS/article/downloadSuppFile/17924/2673";"";"CC-BY-NC-SA";"Copyright (c) 2020 African Journal on Land Policy and Geospatial Sciences";"19";"Artisanal fisher-folk;  Climate change, Coastal communities; Vulnerability index; Factor analysis";""
"AJLPGS:14306";"Climate, Land Use Change and Local Adaptation Strategies in Ecological Areas. Case of Miwaleni River Valley";"Vol 2, No 2: May 2019";"Climate change issues are contemporary global phenomena which affect the largest part of the world in different ways. This paper explores how local communities living in sensitive ecological areas, particularly in river valleys, respond to and adapt to climate change. By employing a qualitative research approach, findings have indicated that heavy rainfall and prolonged droughts coupled with population increase have led to land use changes and loss of biodiversity in the river valley. In turn, 37% of villagers have decided to shift from rain-fed to irrigated agriculture, 34% move to other areas during the heavy rain season while 29% have shifted from agricultural activities. However, due to limited resources and technology, the strategies adapted have not provided satisfactory results. For this case, dam construction in the upper stream and dredging of Miwaleni springs can improve livelihood social and economic activities in the village and sustain biodiversity and ecosystem in the river valley.";"Magina, Fredrick Bwire
Kanyawanah, Zuhura Mtoi
Ardhi University, Pangani Basin Water Office , officials and residents at Miwaleni village";"";"African Journal on Land Policy and Geospatial Sciences";"African Journal on Land Policy and Geospatial Sciences";"2019-05-31";"en";"land use;land use change";"Land, Climate Change & Environment";"002";"Peer-reviewed publication";"https://doi.org/10.48346/IMIST.PRSM/ajlp-gs.v2i2.14306";"https://revues.imist.ma/index.php/AJLP-GS/article/view/14306/9220";"";"CC-BY-NC-SA";"Copyright (c) 2019 African Journal on Land Policy and Geospatial Sciences";"11";"Climate and land use change, Ecological areas, adaptation strategies, Miwaleni river valley";""
"AJLPGS:20911";"A New Approach to the Collection and Spatial Analysis of Land Values in Lomé and Yaoundé";"Vol 3, No 3: September 2020";"Understanding the land market is crucial when analyzing the spatial dynamics of cities. Spatial models, which are widely used to describe the growth of cities, are underdeveloped in Africa, due in part to the lack of urban data and/or the difficulty of collecting it. This paper presents a methodology for collecting analyzing land values in major sub-Saharan African cities. Through two case studies in the cities of Lomé and Yaoundé, it describes the implementation of such a methodology for collecting data on land prices and analyzing variations on an urban scale. It offers effective means of developing more accurate models for analyzing the dynamics of the land market.";"Kemajou, Armel
Bosch, Martí
Chenal, Jérôme
Federal Commission for Scholarships for Foreign Students (FCS), Switzerland, École Polytechnique Fédérale de Lausanne";"";"African Journal on Land Policy and Geospatial Sciences";"African Journal on Land Policy and Geospatial Sciences";"2020-09-28";"en";"";"";"CMR";"Peer-reviewed publication";"https://doi.org/10.48346/IMIST.PRSM/ajlp-gs.v3i3.20911";"https://revues.imist.ma/index.php/AJLP-GS/article/view/20911/12202";"";"CC-BY-NC-SA";"Copyright (c) 2020 African Journal on Land Policy and Geospatial Sciences";"19";"Land value; Spatial Models; Urban data; Lomé, Yaoundé";""
"AJLPGS:13007";"Compulsory Land Acquisition and Good Governance: An Assessment of the Luguruni Satellite Town Project in Dar es Salaam Tanzania";"Vol 1, No 3: December 2018";"Despite a comprehensive regulatory framework on land matters, compulsory land acquisition in Tanzania has been associated with complaints and delays in compensation payments an indication that good governance principles might not be under serious consideration. This paper evaluates land acquisition practices in Tanzania in the light of good governance principles based on interviews and focus group discussions with project affected people and government officials who were involved in Luguruni Satellite Town Project in Dar es Salaam.  It was observed that failure to observe good governance principles was one of the major reasons for dissatisfaction among affected people due to lack of adequate and clear information about the project, little participation, inadequate compensation and non-adherence to procedures.  Enforcement of governance principles would have facilitated the smooth implementation of compulsory land acquisition thereby reducing conflicts and enhance PAPs chance to voluntarily relocate.";"MAKUPA, ELITRUDER RICHARD
ALANANGA, SAMWEL";"";"African Journal on Land Policy and Geospatial Sciences";"African Journal on Land Policy and Geospatial Sciences";"2018-12-31";"en";"assessment;compulsory acquisitions;land";"Land & Investments;Land Conflicts";"002";"Peer-reviewed publication";"https://doi.org/10.48346/IMIST.PRSM/ajlp-gs.v1i3.13007";"https://revues.imist.ma/index.php/AJLP-GS/article/view/13007/8200";"";"CC-BY-NC-SA";"Copyright (c) 2018 African Journal of Geospatial Sciences and Land Governance";"14";"Land, Good governance, compulsory land acquisition, project affected people and Tanzania";""
"AJLPGS:18211";"Unmanned Aerial Vehicles (UAVs) in  urban land regularization process. Opportunities and challenges";"Vol 3, No 1: January 2020, Special Issue 1 on Land Policy in Africa";"Land regularization is an essential ingredient in the formalization on land rights and it plays an important role in improving tenure security of the urban poor. In order to facilitate the process of land regularization, there is need to have up to date spatial information on the settlements earmarked for the regularization process. Ground based survey methods have proved to be time consuming and costly. Thus there is need to adopt cost effective methodology in the acquisition of spatial data. In this study, an approach based on Unmanned Aerial Vehicles (UAVs) was trialed for rapid assessment of a settlement earmarked for land regularization. The approach involved image acquisition for an area of 0.75km2 and processing to generate orthomosaic to aid in the regularization process. The developed approach demonstrates the utility of UAVs in the acquisition of spatial data for urban land regularization.";"Ali, Freeman";"";"African Journal on Land Policy and Geospatial Sciences";"African Journal on Land Policy and Geospatial Sciences";"2020-01-31";"en";"tenure security;urban land";"Indigenous & Community Land Rights;Urban Tenure";"ZWE";"Peer-reviewed publication";"https://doi.org/10.48346/IMIST.PRSM/ajlp-gs.v3i1.18211";"https://revues.imist.ma/index.php/AJLP-GS/article/view/18211/10546";"";"CC-BY-NC-SA";"Copyright (c) 2020 African Journal on Land Policy and Geospatial Sciences";"10";"UAV;Tenure security; Zimbabwe;Land regularization;";""
"AJLPGS:17241";"Reflections on Botswana’s Tribal Land Act no. 1 of 2018";"Vol 2, No 3: September 2019";"In August 2017, Botswana’s parliament passed the Tribal Land Bill, which became the Tribal Land Act no. 1 of 2018. It shall come into operation once the minister sanctions. Until then, the 1994 Act shall be operational. The new Act is aimed at addressing the challenges that cannot be effectively addressed by the operational Act. Some hail it as progressive, but this article argues that the Act has some limitations. Its insistence on the registration of customary grants with the Registrar of Deeds may lead to unintended consequences, such as family conflicts. The Act also aims to strictly regulate the acquisition of tribal land by non-citizens, but this will not address the rising accumulation of land by the local elite through the market. Oddly, the Act and the 2015 land policy contradict each other. Commendably, the Act shall introduce an association of land boards to assist in tackling land problems.";"Manatsha, Boga Thura";"";"African Journal on Land Policy and Geospatial Sciences";"African Journal on Land Policy and Geospatial Sciences";"2019-09-30";"en";"customary land rights;deed registration;land policies";"Indigenous & Community Land Rights;Land Stakeholders & Institutions";"BWA";"Peer-reviewed publication";"https://doi.org/10.48346/IMIST.PRSM/ajlp-gs.v2i3.17241";"https://revues.imist.ma/index.php/AJLP-GS/article/view/17241/9867";"";"CC-BY-NC-SA";"Copyright (c) 2019 African Journal on Land Policy and Geospatial Sciences";"12";"Tribal Land Act, land policy, land boards, Registrar of Deeds, customary land rights";""
"AJLPGS:14962";"L’accès des femmes au foncier dans l’Extrême-Nord du Cameroun Entre persistance de la tradition et dynamiques socio-économiques";"Vol 2, No 1: March 2019, Special Issue on Women&Land";"Les femmes de la région de l’Extrême-Nord du Cameroun font face à un environnement sociologique qui limite leur accès au foncier : mariage, illettrisme et ignorance des dispositions règlementaires, complexité et coût des procédures de sécurisation foncière, facteurs financiers... Par ailleurs, l’accès des femmes au foncier est accompagné des perceptions locales à la fois positives et négatives, mais qui reste fortement influencées par la coutume et les règles traditionnelles. Elles développent diverses stratégies pour accéder au foncier : utilisation du capital économique, urbanisation et opportunités d’achat de terrain constructible, ferme volonté d’affirmation de soi et de se prémunir contre l’incertitude matrimoniale... De plus, des actions ont été menées par diverses ONG et Associations, mais ne sont pas encore satisfaisantes. Les réflexions pour la sécurisation des droits d’accès des femmes au foncier passent par la nécessité d’une réforme législative, réglementaire et des normes sociales.";"Kossoumna Libaa, Natali";"";"African Journal on Land Policy and Geospatial Sciences";"African Journal on Land Policy and Geospatial Sciences";"2019-03-31";"fr";"land access;women";"Indigenous & Community Land Rights;Land & Gender;Land Stakeholders & Institutions;Socio-Economic & Institutional Context";"CMR";"Peer-reviewed publication";"https://doi.org/10.48346/IMIST.PRSM/ajlp-gs.v2i1.14962";"https://revues.imist.ma/index.php/AJLP-GS/article/view/14962/8923";"";"CC-BY-NC-SA";"Copyright (c) 2019 African Journal on Land Policy and Geospatial Sciences";"16";"Femmes, accès au foncier, marginalisation, pesanteurs sociologiques, stratégies d’accès au foncier, Extrême-Nord, Cameroun";""
"AJLPGS:19818";"Suitability Study of the Locations of Continuously Operating Reference Stations (CORS) in Southwestern Nigeria";"Vol 4, No 1: January 2021";"The Study evaluated the locational suitability of established Continuously Operating Reference Stations (CORS) in Southwestern Nigeria and proposed optimum locations for additional CORS in the study area. These were with the view of determining the sufficiency of the existing CORS distribution for various applications in the study area. Secondary data were used for the study. The secondary data used were the shapefiles of the states and local governments as well as the positions of the CORS. The optimum locations of proposed additional CORS were based on 35km buffer distance and which is based on globally acceptable practices for Network Real-time Kinematics (NRTK) distance standard. The study proposed twenty-two new locations in Oyo, Lagos, Ogun, Ekiti and Ondo states for new CORS so as to achieve optimum distribution of CORS for efficient network operations and improved coverage within the region based on globally acceptable practices. The study concluded that the existing and proposed CORS in the study area achieved uniform distribution for accurate geospatial applications in the region.";"Abiri, Anthony Olatunbosun";"";"African Journal on Land Policy and Geospatial Sciences";"African Journal on Land Policy and Geospatial Sciences";"2021-01-29";"en";"";"";"002";"Peer-reviewed publication";"https://doi.org/10.48346/IMIST.PRSM/ajlp-gs.v4i1.19818";"https://revues.imist.ma/index.php/AJLP-GS/article/view/19818/13001";"";"CC-BY-NC-SA";"Copyright (c) 2021 African Journal on Land Policy and Geospatial Sciences";"16";"CORS;GNSS;Spatial Distribution";""
"AJLPGS:13705";"Site Evaluation of Eco-towns using GIS and Analytical Hierarchy Process: Case of Greater Kampala Metropolitan Area";"Vol 1, No 3: December 2018";"Uganda’s total population is projected to increase to 61 million by 2040 in the rations of 37million (60%) to 24million (40%) in the Urban to rural areas respectively. Due to population expansion, Kampala as any other urban area is facing the problems of unplanned rapid growth such as: congestion, unplanned slums amongst others. The Kampala Physical Development Plan pointed out the need to develop new satellite eco-towns in the Greater Kampala Metropolitan Area of Ssisa and Mpatta to contain population explosion and reduce on the problems being experienced in the city. However, the exact location of the eco-towns in Ssisa and Mpatta isn’t known. Based on literature review, surveys and images analysis coupled with the Analytical Hierarchy Process method, the research sought to determine the actual sites. Through a comprehensive evaluation for the new towns, sites selected were those densely located with relatively high scored cells";"Wabineno-Oryema, Lilian Mono";"";"African Journal on Land Policy and Geospatial Sciences";"African Journal on Land Policy and Geospatial Sciences";"2018-12-31";"en";"";"";"UGA";"Peer-reviewed publication";"https://doi.org/10.48346/IMIST.PRSM/ajlp-gs.v1i3.13705";"https://revues.imist.ma/index.php/AJLP-GS/article/view/13705/8170";"";"CC-BY-NC-SA";"Copyright (c) 2018 African Journal on Land Policy and Geospatial Sciences";"16";"Eco-towns, Analytical Hierarchy Process, Greater Kampala, Uganda";""
"AJLPGS:18372";"Agriculture and Rural Transformation in Burkina Faso: Does Land Rights Matter?";"Vol 3: Special Issue 3, 2020";"In the search for rural transformation, this paper analyses the effect of agriculture on rural nonfarm entrepreneurship (NFE) highlighting the role of land rights and assesses the impact of rural NFE on households’ livelihood focusing on rural Burkina Faso. To achieve these objectives, the study uses two techniques: (i) propensity score matching technique to investigate the nonfarm entrepreneurship impact on farm households’ income; (ii) logistic regression to assess the role of agriculture in the development of nonfarm enterprises. Empirical estimates are based on the Living Standards Measurement Study-Integrated Surveys on Agriculture (LSMS-ISA) database of the World Bank. From the results we conclude that rural NFE is pivotal for rural transformation in Burkina Faso given that farm households that engage into NFE enjoy significantly higher per capita income and overall household income. The results allow us in addition to establish that on average, a farmer whose land rights are perfectly secured is more willing to engage into non-farm entrepreneurship activities.  Additional determinants of individual engagement into NFE are shocks, livestock size, age of household head, active female household members and land size. Farming experience has no effect on individual engagement into NFE. These findings call for a redefinition of the agricultural policy and programs of the country to explicitly include rural nonfarm entrepreneurship development strategies component. Such component could target pragmatic land lights policy and the enhancement of the capabilities of farm households to be entrepreneurial.";"PILO, Mikémina";"";"African Journal on Land Policy and Geospatial Sciences";"African Journal on Land Policy and Geospatial Sciences";"2020-11-30";"en";"agriculture;land rights";"Indigenous & Community Land Rights";"BFA";"Peer-reviewed publication";"https://doi.org/10.48346/IMIST.PRSM/ajlp-gs.v3i3.18372";"https://revues.imist.ma/index.php/AJLP-GS/article/view/18372/12713";"";"CC-BY-NC-SA";"Copyright (c) 2020 African Journal on Land Policy and Geospatial Sciences";"10";"";""
