Artikel;Issue;ID;Title;Abstract/Description;Authors;Corporate authors;Publishers;Data Provider;Publicaton date (YYYY/MM);Language;Related concepts;Themes;Overarching Categories;Geographical focus;Resource types;Link to the original website;Link to the publication;Thumbnail;License
1;Family Farming;Rural21-Vol:48-Nr:2/2014-Article:1;“Family farms are key to feeding the world”;José Graziano da Silva, Director-General of the United Nations Food and Agriculture Organization (FAO), on the role of family farms for global food security, the need for sound rural development stategies and the responsibility of governments, the private sector and civil society.;José Graziano da Silva;Food and Agriculture Organization of the United Nations (FAO);DLG-Verlag;Rural21;2014/06;English;"farming systems; farmers; development agencies; food security; rural development";"Land & Food Security; Land Stakeholders & Institutions";Land Use, Management & Investment;Global;Journal Articles & Books;http://www.rural21.com/english/current-issue/detail/article/family-farms-are-key-to-feeding-the-world-00001156/;http://www.rural21.com/uploads/media/rural2014_02-S06-07.pdf;http://www.rural21.com/fileadmin/img/content/Issue/En-2014-02/Seite06.jpg;All rights reserved
2;Family Farming;Rural21-Vol:48-Nr:2/2014-Article:2;More than just a business;Family farming has many different meanings to many different people. While such farms come in all shape and sizes, one thing all practitioners agree on is that family farming is more than a business – it’s a way of life. The following article shows what constitutes this way of life, the challenges that family farms in Europe and throughout the world face and why and how the European Union supports this type of enterprise.;;"European Network for Rural Development; Directorate-General for Agriculture and Rural Development - European Commission";DLG-Verlag;Rural21;2014/06;English;"farming systems; farmers; rural development; agriculture; agricultural land management; development agencies";Land Stakeholders & Institutions;Land Use, Management & Investment;"Europe; Global";Journal Articles & Books;http://www.rural21.com/english/current-issue/detail/article/more-than-just-a-business-00001155/;http://www.rural21.com/uploads/media/rural2014_02-S08-10.pdf;http://www.rural21.com/fileadmin/img/content/Issue/En-2014-02/Seite08.jpg;All rights reserved
3;Family Farming;Rural21-Vol:48-Nr:2/2014-Article:3;What is so special about family farms?;Family farms are especially well suited to meet the challenges of labour organisation in agriculture. In early stages of development, they play a particularly important role in creating productive employment for the major share of the population. Moreover, they have strong incentives to use their resources sustainably so as to pass them on to future generations. Yet, family farms should not be romanticised. Often, they only survive by working longer hours and accepting lower incomes than people employed in other sectors of the economy.;Regina Birner;;DLG-Verlag;Rural21;2014/06;English;"farmers; farming systems; agriculture; agricultural land management; rural population; sustainable land management";Land Stakeholders & Institutions;Land Use, Management & Investment;Global;Journal Articles & Books;http://www.rural21.com/english/current-issue/detail/article/what-is-so-special-about-family-farms-00001154/;http://www.rural21.com/uploads/media/rural2014_02-S11-13.pdf;http://www.rural21.com/fileadmin/img/content/Issue/En-2014-02/Seite11.jpg;All rights reserved
4;Family Farming;Rural21-Vol:48-Nr:2/2014-Article:4;Strenghthening family farms in Mercosur;For a long time, the agricultural policies of the Mercosur states ignored family farming, focusing on promoting individual crops and export production instead. Rural development was not on the agenda. Only after the turn of the millennium did a process of rethinking set in.;Álvaro Ramos Trigo;Programa Fida Mercosur Claeh;DLG-Verlag;Rural21;2014/06;English;"farmers; farming systems; agriculture; agricultural land management; rural development; rural population; sustainable land management; agricultural and rural legislation";;Land Use, Management & Investment;Mercosur;Journal Articles & Books;http://www.rural21.com/english/current-issue/detail/article/strenghthening-family-farms-in-mercosur-00001153/;http://www.rural21.com/uploads/media/rural2014_02-S14-16.pdf;http://www.rural21.com/fileadmin/img/content/Issue/En-2014-02/Seite14.jpg;All rights reserved
5;Family Farming;Rural21-Vol:48-Nr:2/2014-Article:5;Women – the untapped potential for food security;Despite the crucial role of women in family farms and small-scale agriculture, gender inequality is still present in many ways – jeopardising the food and nutrition security of millions of people.;"Nadine Guenther; Christel Weller-Molongua";GIZ;DLG-Verlag;Rural21;2014/06;English;"farmers; women; farming systems; gender equity in access to land; food security; women";"Land & Gender; Land & Food Security";;Global;Journal Articles & Books;http://www.rural21.com/english/current-issue/detail/article/women-the-untapped-potential-for-food-security-00001152/;http://www.rural21.com/uploads/media/rural2014_02-S17-19.pdf;http://www.rural21.com/fileadmin/img/content/Issue/En-2014-02/Seite17.jpg;All rights reserved
6;Family Farming;Rural21-Vol:48-Nr:2/2014-Article:6;"""We have inherited not only a piece of land, but also the responsibility to turn it into a home""";A focus edition on family farming would hardly be credible without giving the family farmers themselves an opportunity to speak. We talked to Moses Munyi, the owner of a six-hectare farm in Embu, Kenya, about his everyday life and about his views of the prospects for farming in the future.;Moses Munyi;;DLG-Verlag;Rural21;2014/06;English;"land inheritance rights; farming systems; farmers";;Land Policy & Legislation;Kenya;Journal Articles & Books;http://www.rural21.com/english/current-issue/detail/article/we-have-inherited-not-only-a-piece-of-land-but-also-the-responsibility-to-turn-it-into-a-home/;http://www.rural21.com/uploads/media/rural2014_02-S20-22.pdf;http://www.rural21.com/fileadmin/img/content/Issue/En-2014-02/Seite20.jpg;All rights reserved
7;Family Farming;Rural21-Vol:48-Nr:2/2014-Article:7;Machinery rings – a mechanisation concept for African farmers?;One of the basic conditions of empowering farmers is to get them organised. Machinery rings are a promising organisational concept to link up the farms and raise their profitability and power by promoting mechanisation in rural areas.;Katharina Schlemper;;DLG-Verlag;Rural21;2014/06;English;"farming systems; farmers; rural development; agricultural land management";;Land Use, Management & Investment;Africa;Journal Articles & Books;http://www.rural21.com/english/current-issue/detail/article/machinery-rings-a-mechanisation-concept-for-african-farmers-00001150/;http://www.rural21.com/uploads/media/rural2014_02-S23-23.pdf;http://www.rural21.com/fileadmin/img/content/Issue/En-2014-02/Seite23.jpg;All rights reserved
8;Family Farming;Rural21-Vol:48-Nr:2/2014-Article:8;Agricultural biodiversity: the foundation of resilient family farms;In a world of rapidly changing conditions, enhancing the adaptability and hence the resilience of family farms is crucial to their viability. Here, diversity plays an important role, as the following article demonstrates.;Ann Tutwiler;Bioversity International;DLG-Verlag;Rural21;2014/06;English;"farmers; farming systems; sustainable land management";;Land Use, Management & Investment;Global;Journal Articles & Books;http://www.rural21.com/english/current-issue/detail/article/agricultural-biodiversity-the-foundation-of-resilient-family-farms-00001149/;http://www.rural21.com/uploads/media/rural2014_02-S24-26.pdf;http://www.rural21.com/fileadmin/img/content/Issue/En-2014-02/Seite24.jpg;All rights reserved
9;Family Farming;Rural21-Vol:48-Nr:2/2014-Article:9;Tangible sustainability;Family farms are often associated with greater sustainability. But the definition of sustainability is a highly disputable topic. The School of Agricultural, Forest and Food Sciences (HAFL) in Switzerland has developed a method enabling a more objective evaluation of sustainability in agriculture. Response-Inducing Sustainability Evaluation (RISE) covers ten sustainability indicators and supplies the foundation for agricultural advice.;"Alexander Schöning; Alberto Camacho";GIZ;DLG-Verlag;Rural21;2014/06;English;"farming systems; sustainable land management; research; agriculture; agricultural land management";Land Stakeholders & Institutions;Land Use, Management & Investment;"Global; Switzerland";Journal Articles & Books;http://www.rural21.com/english/current-issue/detail/article/tangible-sustainability-00001148/;http://www.rural21.com/uploads/media/rural2014_02-S27-28.pdf;http://www.rural21.com/fileadmin/img/content/Issue/En-2014-02/Seite27.jpg;All rights reserved
10;Family Farming;Rural21-Vol:48-Nr:2/2014-Article:10;Family farming – a model with a future?;Is there good reason to make family farms a focus of global attention for a year? Or is it not rather reckless to advocate a concept while completely disregarding the fact that the necessary conditions are often not in place? A few entirely personal thoughts on the International Year of Family Farming.;Karl-Martin Lüth;;DLG-Verlag;Rural21;2014/06;English;"farming systems; farmers; agricultural land management";;Land Use, Management & Investment;Global;Journal Articles & Books;http://www.rural21.com/english/current-issue/detail/article/family-farming-a-model-with-a-future-00001147/;http://www.rural21.com/uploads/media/rural2014_02-S29-31.pdf;http://www.rural21.com/fileadmin/img/content/Issue/En-2014-02/Seite29.jpg;All rights reserved
11;Family Farming;Rural21-Vol:48-Nr:2/2014-Article:11;Integrated Watershed Management – an approach with a number of stumbling-blocks;Integrated Watershed Management represents an option for the management of water catchment areas. However, what may sound good in theory often proves to be very difficult when it comes to practical implementation, as an example from the Lower Mekong Region shows.;;Centre for Rural Development;DLG-Verlag;Rural21;2014/06;English;"land management; water management; water rights; sustainable land management";;Land Use, Management & Investment;"Vietnam; Cambodia; Lao; Thailand; Myanmar";Journal Articles & Books;http://www.rural21.com/english/current-issue/detail/article/integrated-watershed-management-an-approach-with-a-number-of-stumbling-blocks-00001146/;http://www.rural21.com/uploads/media/rural2014_02-S32-34.pdf;http://www.rural21.com/fileadmin/img/content/Issue/En-2014-02/Seite33.jpg;All rights reserved
12;Family Farming;Rural21-Vol:48-Nr:2/2014-Article:12;FlexiBiogas – a climate change adaptation and mitigation technology;Access to modern renewable energy services are a key input to poverty eradication and in ensuring food security. Biogas is a renewable energy option suited to provide clean, modern and decentralised sources of energy. Portable systems, such as FlexiBiogas, offer a lot of advantages over traditional fixed dome systems.;"Antonio Rota; Karan Sehgal";International Fund for Agricultural Development (IFAD);DLG-Verlag;Rural21;2014/06;English;"poverty; food security; agricultural land management; farming systems";Land & Food Security;Land Use, Management & Investment;Global;Journal Articles & Books;http://www.rural21.com/english/current-issue/detail/article/flexibiogas-a-climate-change-adaptation-and-mitigation-technology-00001145/;http://www.rural21.com/uploads/media/rural2014_02-S35-37.pdf;http://www.rural21.com/fileadmin/img/content/Issue/En-2014-02/Seite37.jpg;All rights reserved
13;Family Farming;Rural21-Vol:48-Nr:2/2014-Article:13;Rebuilding soil natural capital;Throughout the world, demands on finite soil resources are ever increasing, and can lead to irreversible soil degradation, as the soil is used beyond its “bio-capacity”. A quarter of the inhabitated land area has already been affected by human-induced soil degradation. Against this background, soil remediaton is becoming more and more important. Focusing on the rehabilitation of oil-contaminated soil in Kuwait, the following article shows how it works, and where the problems lie;Bedanga Bordoloi ;;DLG-Verlag;Rural21;2014/06;English;"farming systems; natural resources management; sustainable land management; land area; land degradation";Land, Climate change & Environment;Land Use, Management & Investment;Global;Journal Articles & Books;http://www.rural21.com/english/current-issue/detail/article/rebuilding-soil-natural-capital-00001144/;http://www.rural21.com/uploads/media/rural2014_02-S38-39.pdf;http://www.rural21.com/fileadmin/img/content/Issue/En-2014-02/Seite38.jpg;All rights reserved
14;Family Farming;Rural21-Vol:48-Nr:2/2014-Article:14;"Boosting commercial sorghum production and marketing with the ""aggregator model""";How can the private sector contribute to the fight against hunger, poverty and malnutrition in the remote areas of sub-Saharan Africa? This article looks at a model that has been applied in Kenya and Tanzania, addressing the right tools, skills and knowledge to make smallholder production a success.;"Daniel Kamanga; Doreen Marangu; Nehemiah Mburu; Florence Wambugu";Africa Harvest;DLG-Verlag;Rural21;2014/06;English;"poverty; food security; development agencies; farming systems; sustainable development";"Land Stakeholders & Institutions; Land & Food Security";;"Kenya; Tanzania";Journal Articles & Books;http://www.rural21.com/english/current-issue/detail/article/boosting-commercial-sorghum-production-and-marketing-with-the-aggregator-model-00001143/;http://www.rural21.com/uploads/media/rural2014_02-S40-42.pdf;http://www.rural21.com/fileadmin/img/content/Issue/En-2014-02/Seite40.jpg;All rights reserved
1;Livestock;Rural21-Vol:48-Nr:4/2014-Article:1;Livestock matter;Livestock are critical to building sustainability in food and agriculture. Current and future livestock sector development needs to produce more, from less, and in ways that benefit all. Solving the sector’s challenges requires stakeholders to find common ground and to join forces towards continuous practice change. The Global Agenda for Sustainable Livestock is one example of these new ways of working.;"Henning Steinfeld; Jeroen Dijkman";Food and Agriculture Organization of the United Nations (FAO);DLG-Verlag;Rural21;2014/11;English;"food security; agriculture; agricultural land management";;Land Use, Management & Investment;Global;Journal Articles & Books;http://www.rural21.com/english/current-issue/detail/article/livestock-matter-00001324/;http://www.rural21.com/uploads/media/rural2014_04-S06-08.pdf;http://www.rural21.com/fileadmin/img/content/Issue/En-2014-04/Seite07.jpg;All rights reserved
2;Livestock;Rural21-Vol:48-Nr:4/2014-Article:2;Livestock: recyclers that promote the sustainability of smallholder farms;Livestock are kept for a wide range of purposes in Africa, and there is considerable diversity in animal husbandry. Among the most important advantages in keeping animals is their contribution to maintaining and even improving soil fertility. Furthermore, animal husbandry offers economic, social and cultural benefits. However, the authors also look at the constraints that smallholders face in livestock husbandry.;"Pierre Hiernaux; Mamadou Oumar Diawara";;DLG-Verlag;Rural21;2014/11;English;"animal husbandry; land management; sustainable land management; agriculture; farming systems";Rangelands, Drylands & Pastoralism;Land Use, Management & Investment;Africa;Journal Articles & Books;http://www.rural21.com/english/current-issue/detail/article/livestock-recyclers-that-promote-the-sustainability-of-smallholder-farms-00001323/;http://www.rural21.com/uploads/media/rural2014_04-S09-11.pdf;http://www.rural21.com/fileadmin/img/content/Issue/En-2014-04/Seite10.jpg;All rights reserved
3;Livestock;Rural21-Vol:48-Nr:4/2014-Article:3;Tropical forage-based systems for climate-smart livestock production in Latin America;Tropical forage grasses and legumes as key components of sustainable crop-livestock systems in Latin America and the Caribbean have major implications for improving food security, alleviating poverty, restoring degraded lands and mitigating climate change. Climate-smart tropical forage crops can improve the livestock productivity of smallholder farming systems and break the cycle of poverty and resource degradation. Sustainable intensification of forage-based systems contributes to better human nutrition, increases farm incomes, raises soil carbon accumulation and reduces greenhouse gas emissions.;"Idupulapati Rao; Michael Peters; Rein van der Hoek; Aracely Castro";;DLG-Verlag;Rural21;2014/11;English;"farming systems; food security; poverty; land degradation; climate change; sustainable land management; natural resources management";"Land, Climate change & Environment; Land & Food Security";Land Use, Management & Investment;Latin America & the Caribbean;Journal Articles & Books;http://www.rural21.com/english/current-issue/detail/article/tropical-forage-based-systems-for-climate-smart-livestock-production-in-latin-america-00001322/;http://www.rural21.com/uploads/media/rural2014_04-S12-15.pdf;http://www.rural21.com/fileadmin/img/content/Issue/En-2014-04/Seite13.jpg;All rights reserved
4;Livestock;Rural21-Vol:48-Nr:4/2014-Article:4;Pasture management in Central Asia – regional learning for reform;The former Soviet Central Asian republics have undergone de-intensification of their livestock sectors, resulting in an increased reliance on natural pastures. Property rights systems are key to the sustainable management of this resource. However, as the authors demonstrate, it is not easy to implement the respective reform processes.;"Sarah Robinson; André Fabian";;DLG-Verlag;Rural21;2014/11;English;"pastoralists; agriculture; property rights; sustainable land management; natural resources management; land governance; pastoral land rights";Rangelands, Drylands & Pastoralism;"Access to Land & Tenure Security; Land Policy & Legislation";Central Asia;Journal Articles & Books;http://www.rural21.com/english/current-issue/detail/article/pasture-management-in-central-asia-regional-learning-for-reform-00001321/;http://www.rural21.com/uploads/media/rural2014_04-S16-18.pdf;http://www.rural21.com/fileadmin/img/content/Issue/En-2014-04/Seite16.jpg;All rights reserved
5;Livestock;Rural21-Vol:48-Nr:4/2014-Article:5;Pastoralism and conflict – two sides of a coin?;Pastoralism – the predominant form of livestock keeping in the Horn of Africa – has always been a source of disputes and tensions in the region. So it is maybe no coincidence that precisely those countries with the largest cattle and camel herds should be the ones that have been suffering from prolonged armed conflict for years. This article takes a look at the closely interwoven aspects influencing conflicts in the Horn of Africa in general and South Sudan more specifically.;"Cornelia Heine; Elisabeth Hartwig";;DLG-Verlag;Rural21;2014/11;English;"pastoralists; pastoral land rights; land dispute; land conflicts";"Rangelands, Drylands & Pastoralism; Land Conflicts";Access to Land & Tenure Security;"Africa; South Africa";Journal Articles & Books;http://www.rural21.com/english/current-issue/detail/article/pastoralism-and-conflict-two-sides-of-a-coin-00001320/;http://www.rural21.com/uploads/media/rural2014_04-S19-21.pdf;http://www.rural21.com/fileadmin/img/content/Issue/En-2014-04/Seite19.jpg;All rights reserved
6;Livestock;Rural21-Vol:48-Nr:4/2014-Article:6;Linking poor livestock keepers to markets;The growing global demand for animal products also offers poor livestock keepers the opportunity to switch from the subsistence to the market economy. Our author gives an account of three approaches in the meat and dairy sector in Africa and Asia with their respective potentials and limitations – and also warns against possible negative effects.;Isabelle Baltenweck;International Livestock Research Institute;DLG-Verlag;Rural21;2014/11;English;"farmers; farming systems; agricultural land management";Rangelands, Drylands & Pastoralism;Land Use, Management & Investment;"Africa; Asia";Journal Articles & Books;http://www.rural21.com/english/current-issue/detail/article/linking-poor-livestock-keepers-to-markets-00001319/;http://www.rural21.com/uploads/media/rural2014_04-S22-24.pdf;http://www.rural21.com/fileadmin/img/content/Issue/En-2014-04/Seite22.jpg;All rights reserved
7;Livestock;Rural21-Vol:48-Nr:4/2014-Article:7;Milk production pays off! – Experiences of a DPPP approach in Northern Sri Lanka;Initiated by an international packaging company and a local retailer enterprise a project was set up in the Jaffna district in 2013 supported by the GIZ “development partnerships with the private sector” (develoPPP) initiative. The project aims at an increased quality and quantity of milk production and medium-term coverage of the regional demand. Within a couple of months, the monthly collected amount of milk has increased from 3,100 litres to 35,610 litres, and the number of participating farmers has increased tenfold.;Carola von Morstein;GIZ;DLG-Verlag;Rural21;2014/11;English;"farming systems; agricultural land management; land governance";;Land Use, Management & Investment;Sri Lanka;Journal Articles & Books;http://www.rural21.com/english/current-issue/detail/article/milk-production-pays-off-experiences-of-a-dppp-approach-in-northern-sri-lanka-00001318/;http://www.rural21.com/uploads/media/rural2014_04-S25-25.pdf;http://www.rural21.com/fileadmin/img/content/Issue/En-2014-04/Seite25.jpg;All rights reserved
8;Livestock;Rural21-Vol:48-Nr:4/2014-Article:8;Food security and poverty mitigation through smallholder dairy – the Zambian case;Supporting smallholder farmers is one of the best ways to fight poverty and ensure food security. Such support involving the active participation of smallholder farmers in Zambia has demonstrated a significant increase in farmers’ engagement in general and an improvement in milk production, resulting in nutritional food security both at household and national level and income for the poor farmers.;Girja S. Pandey;;DLG-Verlag;Rural21;2014/11;English;"food security; poverty; farming systems; farmers; sustainable development";Land & Food Security;;Zambia;Journal Articles & Books;http://www.rural21.com/english/current-issue/detail/article/food-security-and-poverty-mitigation-through-smallholder-dairy-the-zambian-case-00001317/;http://www.rural21.com/uploads/media/rural2014_04-S26-27.pdf;http://www.rural21.com/fileadmin/img/content/Issue/En-2014-04/Seite26.jpg;All rights reserved
9;Livestock;Rural21-Vol:48-Nr:4/2014-Article:9;Animal husbandry in cities – using potentials, reducing risks;Not only rabbits and guinea-pigs but sheep, goats, cattle and pigs also play a crucial role in the food and income situation of countless city-dwellers world-wide. However, when people and animals live in such close proximity, health risks are inevitable. But instead of banning urban animal husbandry, as was, for example, considered in the course of the swine influenza epidemic, framework conditions ought to be created that enable people to make use of this business branch to earn a profit without running risks.;Carola von Morstein;GIZ;DLG-Verlag;Rural21;2014/11;English;"animal husbandry; farming systems; suburban agriculture; urban population";Urban Tenure;Land Use, Management & Investment;Global;Journal Articles & Books;http://www.rural21.com/english/current-issue/detail/article/animal-husbandry-in-cities-using-potentials-reducing-risks-00001316/;http://www.rural21.com/uploads/media/rural2014_04-S28-30.pdf;http://www.rural21.com/fileadmin/img/content/Issue/En-2014-04/Seite28.jpg;All rights reserved
10;Livestock;Rural21-Vol:48-Nr:4/2014-Article:10;The insatiable hunger for cheap meat;If the current trend in global meat demand persists, meat production will need to rise from 300 million tons today to 470 million tons by 2050. Climate and our natural resources would lose out, our author warns.;Christine Chemnitz;Heinrich Böll Foundation;DLG-Verlag;Rural21;2014/11;English;"food security; farming systems; natural resources management; sustainable land management; environment";"Land, Climate change & Environment; Land & Food Security";Land Use, Management & Investment;Global;Journal Articles & Books;http://www.rural21.com/english/current-issue/detail/article/the-insatiable-hunger-for-cheap-meat-00001314/;http://www.rural21.com/uploads/media/rural2014_04-S34-35.pdf;http://www.rural21.com/fileadmin/img/content/Issue/En-2014-04/Chemnitz.jpg;All rights reserved
11;Livestock;Rural21-Vol:48-Nr:4/2014-Article:11;Mindsets for sustainability – let’s start with feed!;Nowadays it is hard to imagine European livestock production without soya-based feed. But this trend has had a massive impact on rural areas in the global South – the bulk of the soya fed to livestock in Europe is imported from Argentina and Brazil. That is not sustainable, says WWF’s Birgit Wilhelm, who advocates a change in mindset. ;Birgit Wilhelm;World Wildlife Fund;DLG-Verlag;Rural21;2014/11;English;"farming systems; sustainable land management";;Land Use, Management & Investment;"Argentina; Brazil; Europe";Journal Articles & Books;http://www.rural21.com/english/current-issue/detail/article/mindsets-for-sustainability-lets-start-with-feed-00001313/;http://www.rural21.com/uploads/media/rural2014_04-S36-37.pdf;http://www.rural21.com/fileadmin/img/content/Issue/En-2014-04/Wilhelm.jpg;All rights reserved
