12;Livestock;Rural21-Vol:48-Nr:4/2014-Article:12;China’s biomass energy development – a perception change from waste to resource;China has a longstanding tradition of using biogas for decentralised energy supply. Already, there are nearly 42 million household digesters in the rural areas, a figure set to double by 2020. But the country has even more ambitious plans. In order to achieve its own climate targets and raise the share of renewables in overall energy supply to 15 per cent by 2020, it wants to set up 16,000 middle- and large-scale biogas plants. However, implementation isn’t quite so easy.;"Michael Oos; Friederike Martin";GIZ;DLG-Verlag;Rural21;2014/11;English;"climate change; environment; sustainable land management; rural development; agriculture; agricultural land management";Land, Climate change & Environment;Land Use, Management & Investment;China;Journal Articles & Books;http://www.rural21.com/english/current-issue/detail/article/chinas-biomass-energy-development-a-perception-change-from-waste-to-resource-00001312/;http://www.rural21.com/uploads/media/rural2014_04-S38-40.pdf;http://www.rural21.com/fileadmin/img/content/Issue/En-2014-04/Seite38.jpg;All rights reserved
13;Livestock;Rural21-Vol:48-Nr:4/2014-Article:13;Unleashing the potential of family farming;Converting from subsistence to market-oriented farming can increase income. Thanks to the ’Enabling Rural Innovation’ approach, family farmers in Uganda and Tanzania have succeeded in improving production and fetching better prices for their produce while safeguarding food security and sustainable management of natural resources. The recipe for success is that farmers take the development process in their own hands.;"Thomas Pircher; Amos Owamani";;DLG-Verlag;Rural21;2014/11;English;"farming systems; rural development; farmers; agricultural land management; food security; natural resources management; sustainable land management";Land & Food Security;Land Use, Management & Investment;"Uganda; Tanzania";Journal Articles & Books;http://www.rural21.com/english/current-issue/detail/article/unleashing-the-potential-of-family-farming-00001311/;http://www.rural21.com/uploads/media/rural2014_04-S41-43.pdf;http://www.rural21.com/fileadmin/img/content/Issue/En-2014-04/Seite41.jpg;All rights reserved
1;Rural Markets;Rural21-Vol:47-Nr:2/2013-Article:1;Why markets matter;Rural markets are important traditional institutional frameworks which perform a number of key functions in rural societies. Our author presents the major ones in Nigeria.;Adegboyega Eyitayo Oguntade;;DLG-Verlag;Rural21;2013/06;English;"rural population; land markets";;Land Use, Management & Investment;Nigeria;Journal Articles & Books;http://www.rural21.com/english/current-issue/detail/article/why-markets-matter-0000736/;http://www.rural21.com/uploads/media/rural2013_02-S06-07.pdf;http://www.rural21.com/fileadmin/img/content/Issue/En-2013-02/focus13_02_why-marketts.jpg;All rights reserved
2;Rural Markets;Rural21-Vol:47-Nr:2/2013-Article:2;New marketing structures: new chances, new risks;Market liberalisation in the 1980/90s brought about fundamental changes to marketing structures in Africa, creating new opportunities but also, often, making it more difficult for smallholders to access markets.;Dr G. E. Onumah;;DLG-Verlag;Rural21;2013/06;English;"land markets; land access; land governance";;"Land Use, Management & Investment; Land Policy & Legislation";Africa;Journal Articles & Books;http://www.rural21.com/english/current-issue/detail/article/new-marketing-structures-new-chances-new-risks-0000748/;http://www.rural21.com/uploads/media/rural2013_02-S08-08.pdf;http://www.rural21.com/fileadmin/img/content/Issue/En-2013-02/focus13_02_new-marketing.jpg;All rights reserved
3;Rural Markets;Rural21-Vol:47-Nr:2/2013-Article:3;A boost for inclusive farmer-trader relationships;Representing 30 per cent of Ghana’s formal trade in maize, the Techiman market serves as the main cereals trade platform within the country and the sub-region. However, its role in the region’s economic development is threatened by several shortcomings. The Municipal Assembly and the Techiman traders have therefore launched an innovative public-private initiative to upgrade the maize market infrastructure.;"Margret Will; Matthias Plewa";;DLG-Verlag;Rural21;2013/06;English;"land markets; land governance; rural development";;Land Use, Management & Investment;Ghana;Journal Articles & Books;http://www.rural21.com/english/current-issue/detail/article/a-boost-for-inclusive-farmer-trader-relationships-0000747/;http://www.rural21.com/uploads/media/rural2013_02-S09-11.pdf;http://www.rural21.com/fileadmin/img/content/Issue/En-2013-02/focus13_02_a-boost.jpg;All rights reserved
4;Rural Markets;Rural21-Vol:47-Nr:2/2013-Article:4;Better grain marketing with warehouse receipt systems;Grain markets in Africa suffer from a range of constraints. Smallholder farmers are particularly affected owing to their vulnerability to price fluctuations and their weak bargaining position. Many African governments as well as donors reckon with improvements through warehouse receipt systems. The article illustrates the theoretical potential of the WRS and some of the obstacles in setting them up in African countries.;Dr G. E. Onumah;;DLG-Verlag;Rural21;2013/06;English;"land markets; farming systems; land governance; land management";Land Stakeholders & Institutions;Land Use, Management & Investment;Africa;Journal Articles & Books;http://www.rural21.com/english/current-issue/detail/article/better-grain-marketing-with-warehouse-receipt-systems-0000746/;http://www.rural21.com/uploads/media/rural2013_02-S12-15.pdf;http://www.rural21.com/fileadmin/img/content/Issue/En-2013-02/focus13_02_better-grain.jpg;All rights reserved
5;Rural Markets;Rural21-Vol:47-Nr:2/2013-Article:5;Advocacy for free trade;Regional trade bears a great potential to improve food security in West Africa. Again and again, however, efforts made in this field by organisations such as ECOWAS and UEMOA are frustrated by the policies of individual countries.;Suzanne Ngo-Eyok;;DLG-Verlag;Rural21;2013/06;English;"land markets; food security; development agencies; advocacy";"Land & Food Security; Land Stakeholders & Institutions";Land Use, Management & Investment;Western Africa;Journal Articles & Books;http://www.rural21.com/english/current-issue/detail/article/advocacy-for-free-trade-0000745/;http://www.rural21.com/uploads/media/rural2013_02-S16-17.pdf;http://www.rural21.com/fileadmin/img/content/Issue/En-2013-02/focus13_02_advocacy.jpg;All rights reserved
6;Rural Markets;Rural21-Vol:47-Nr:2/2013-Article:6;Where is food logistics going?;Logistics costs play a decisive role in food price development, especially when looking at local agricultural supply chains, e.g. for fruit and vegetables. The logistics cost burden on groceries varies greatly, depending on the prevalent supply chain setup. This article discusses the pros and cons of a traditional supply of agricultural produce into cities versus a modernised logistics setup, involving organised retail chains. This comparison is illustrated using the example of India, a country where the Government has recently decided to legalise foreign direct investment (FDI) in the retail sector.;Bernhard Herzog;GIZ;DLG-Verlag;Rural21;2013/06;English;"land markets; food security; agriculture; agricultural land management; land investments";"Land & Food Security; Land & Investments";Land Use, Management & Investment;Global;Journal Articles & Books;http://www.rural21.com/english/current-issue/detail/article/where-is-food-logistics-going-0000744/;http://www.rural21.com/uploads/media/rural2013_02-S18-21.pdf;http://www.rural21.com/fileadmin/img/content/Issue/En-2013-02/focus13_02_food-logistic.jpg;All rights reserved
7;Rural Markets;Rural21-Vol:47-Nr:2/2013-Article:7;BioTrade – development opportunities for small farmers in Peru;Not only is biodiversity a valuable asset, but it also represents a possible source of income for rural communities. The article shows how Peru is making use of this potential in the context of the BioTrade concept to sustain both, rural livelihood and conservation of native biodiversity. It further analyses the challenges farmers face and how targeted support for supply chains can help to overcome these challenges.;"Katharina Wortmann; Silke Spohn; Luis Rosa Pérez";GIZ;DLG-Verlag;Rural21;2013/06;English;"land markets; agricultural land management; rural population; land environment; sustainable land management; environment; farmers; farming systems";Land, Climate change & Environment;Land Use, Management & Investment;Peru;Journal Articles & Books;http://www.rural21.com/english/current-issue/detail/article/biotrade-development-opportunities-for-small-farmers-in-peru-0000743/;http://www.rural21.com/uploads/media/rural2013_02-S22-24.pdf;http://www.rural21.com/fileadmin/img/content/Issue/En-2013-02/focus13_02_biotrade.jpg;All rights reserved
8;Rural Markets;Rural21-Vol:47-Nr:2/2013-Article:8;Irrigation and markets – a fertile combination for poverty reduction;In the early 1980s, Germany’s KfW Development Bank financed the first irrigation project around Mount Kenya. A reliable supply of water was expected to enable farmers to achieve stable yields. In this way, they could not only safeguard their own food supply but also supply new markets and earn themselves an income. The following article takes stock of progress and benefits.;Isabel Huber;;DLG-Verlag;Rural21;2013/06;English;"land markets; farmers; farming systems; agricultural land management; food security; development agencies";"Land & Food Security; Land Stakeholders & Institutions";Land Use, Management & Investment;Kenya;Journal Articles & Books;http://www.rural21.com/english/current-issue/detail/article/irrigation-and-markets-a-fertile-combination-for-poverty-reduction-0000742/;http://www.rural21.com/uploads/media/rural2013_02-S25-27.pdf;http://www.rural21.com/fileadmin/img/content/Issue/En-2013-02/focus13_02_irrigation.jpg;All rights reserved
9;Rural Markets;Rural21-Vol:47-Nr:2/2013-Article:9;Taking the land without encumbrances;Liberia’s government seeks to put greater emphasis on integrated cash/food crop systems with broad-based farmer participation. However, shortcomings in regulations on land transactions could threaten livelihoods in what is already a vulnerable country.;"Rudolf Buntzel; Wollor Topor";;DLG-Verlag;Rural21;2013/06;English;"land markets; farmers; land law; land policies; land transactions; security of tenure (land); land grabbing";Land & Investments;"Access to Land & Tenure Security; Land Policy & Legislation";Liberia;Journal Articles & Books;http://www.rural21.com/english/current-issue/detail/article/taking-the-land-without-encumbrances-0000740/;http://www.rural21.com/uploads/media/rural2013_02-S30-33.pdf;http://www.rural21.com/fileadmin/img/content/Issue/En-2013-02/intplat_13_02_taking.jpg;All rights reserved
10;Rural Markets;Rural21-Vol:47-Nr:2/2013-Article:10;Microfinance lending for farming in Congo – a worthwhile risk?;Agriculture is the basis for the livelihoods of the rural Congolese population. Yet despite its considerable potential, the sector and its many smallscale producers are barely served by microfinance institutions. The lack of adapted financial products for development of the farming sector is one of the reasons for the country’s continuing dependence on food imports.;"Erik Engel; Jakob Lutz";;DLG-Verlag;Rural21;2013/06;English;"agriculture; rural population; land markets; farmers; farming systems; agricultural land management";;Land Use, Management & Investment;Congo;Journal Articles & Books;http://www.rural21.com/english/current-issue/detail/article/microfinance-lending-for-farming-in-congo-a-worthwhile-risk-0000739/;http://www.rural21.com/uploads/media/rural2013_02-S34-36.pdf;http://www.rural21.com/fileadmin/img/content/Issue/En-2013-02/intplat_13_02_microfinance.jpg;All rights reserved
11;Rural Markets;Rural21-Vol:47-Nr:2/2013-Article:11;A conflict-sensitive approach is needed;Despite good potential for food production, South Sudan’s agriculture is not feeding its population. The impacts of decades of armed conflict are posing enormous challenges for the sector. Farmer Field Schools seem to be a promising instrument to improve food security and livelihoods of small-scale farmers in the country.;"Enno Mewes; Ilse Hoffmann";;DLG-Verlag;Rural21;2013/06;English;"land markets; land conflicts; food security; rural development; farming systems";"Land & Food Security; Land Conflicts";Land Use, Management & Investment;South Sudan;Journal Articles & Books;http://www.rural21.com/english/current-issue/detail/article/a-conflict-sensitive-approach-is-needed-0000738/;http://www.rural21.com/uploads/media/rural2013_02-S37-39.pdf;http://www.rural21.com/fileadmin/img/content/Issue/En-2013-02/intplat_13_02_conflict.jpg;All rights reserved
12;Rural Markets;Rural21-Vol:47-Nr:2/2013-Article:12;Markets for the many rather than the few;A development policy opting exclusively for value chain development and the integration of producers in modern markets overlooks the reality for the majority of smallholders, our author maintains. Policy should pay greater attention to addressing the area most small-scale producers are active in: the informal sector.;Bill Vorley;International Institute for Environment and Development;DLG-Verlag;Rural21;2013/06;English;"land markets; land economics; farmers; customary tenure; land tenure systems; development; development agencies";Land Stakeholders & Institutions;"Land Policy & Legislation; Access to Land & Tenure Security";Global;Journal Articles & Books;http://www.rural21.com/english/current-issue/detail/article/markets-for-the-many-rather-than-the-few-0000741/;http://www.rural21.com/uploads/media/rural2013_02-S28-29.pdf;http://www.rural21.com/fileadmin/img/content/Issue/En-2013-02/Vorley.jpg;All rights reserved
13;Rural Markets;Rural21-Vol:47-Nr:2/2013-Article:13;Moving towards resilient farming in northern Ethiopia;Improving watershed conservation and household food security has been one of the major development challenges in the semi-arid areas of northern Ethiopia. The initial survey by ILRI’s Improving Productivity and Marketing Success project has revealed that physical conservation measures alone do not result in higher farmers’ income. However, the introduction of market-oriented commodity development such as beekeeping, sheep-fattening, and high value crops resulted in farmers’ income rising fivefold from 2005 to 2009.;"Gebremedhin Woldewahid; Berhanu Gebremedhin; Dirk Hoekstra; Azage Tegegne";International Livestock Research Institute;DLG-Verlag;Rural21;2013/06;English;"land markets; food security; farming systems; sustainable land management; environment; development agencies";"Land Stakeholders & Institutions; Land & Food Security; Land, Climate change & Environment";Land Use, Management & Investment;Ethiopia;Journal Articles & Books;http://www.rural21.com/english/current-issue/detail/article/moving-towards-resilient-farming-in-northern-ethiopia-0000737/;http://www.rural21.com/uploads/media/rural2013_02-S40-42.pdf;http://www.rural21.com/fileadmin/img/content/Issue/En-2013-02/scientific_13_02_moving1.jpg;All rights reserved
1;Agricultural policies;Rural21-Vol:47-Nr:4/2013-Article:1;Agricultural policies in the 2010’s: the contemporary agenda;Agricultural development has moved up the agenda. Today it has not only to reduce poverty and hunger, but also become environmentally sustainable and climate smart. Disputes over agricultural policies are highly visible, but consensus exists on fundamentals for growth. It is not just what to do that matters, but also how to do it. Increasingly, the search is not for optimal policy, but for ‘good fit’, or even ‘good-enough’ policy.;Steve Wiggins;Overseas Development Institute;DLG-Verlag;Rural21;2013/12;English;"rural development; land policies; agricultural and rural legislation; land dispute; land governance";;Land Policy & Legislation;Global;Journal Articles & Books;http://www.rural21.com/english/current-issue/detail/article/agricultural-policies-in-the-2010s-the-contemporary-agenda-0000965/;http://www.rural21.com/uploads/media/rural2013_04-S08-10.pdf;http://www.rural21.com/fileadmin/img/content/Issue/En-2013-04/Seite08.jpg;All rights reserved
2;Agricultural policies;Rural21-Vol:47-Nr:4/2013-Article:2;Providing an enabling environment;The basic role for agricultural policies consists of providing the core investments and services that farmers need to develop their operations into viable farm businesses. Focusing on the sector’s enabling environment benefits both agriculture and the wider rural economy, facilitating the construction of diversified rural economies. Such policies are likely to be more effective in the long term than subsidies or market interventions, which have the opposite tendency.;Jonathan Brooks;Organisation for Economic Co-operation and Development (OECD);DLG-Verlag;Rural21;2013/12;English;"land policies; agricultural and rural legislation; farming systems; farmers";;Land Policy & Legislation;Global;Journal Articles & Books;http://www.rural21.com/english/current-issue/detail/article/providing-an-enabling-environment-0000964/;http://www.rural21.com/uploads/media/rural2013_04-S11-13.pdf;http://www.rural21.com/fileadmin/img/content/Issue/En-2013-04/Seite11.jpg;All rights reserved
3;Agricultural policies;Rural21-Vol:47-Nr:4/2013-Article:3;Food security needs policy coherence;"The 2013 OECD publication ""Better Policies for Development"" emphasises that building global food security requires a cross-cutting approach to policy coherence for development. It explores ways in which more coherent policies in advanced, emerging and developing economies alike, as well as, globally can contribute to improved global food security.";Ernesto Soria Morales;Organisation for Economic Co-operation and Development (OECD);DLG-Verlag;Rural21;2013/12;English;"food security; land policies; sustainable development";"Land & Food Security; Land Stakeholders & Institutions";Land Policy & Legislation;Global;Journal Articles & Books;http://www.rural21.com/english/current-issue/detail/article/food-security-needs-policy-coherence-0000971/;;http://www.rural21.com/fileadmin/img/content/Issue/En-2013-04/Closer_OECD.jpg;All rights reserved
4;Agricultural policies;Rural21-Vol:47-Nr:4/2013-Article:4;Food security, agricultural policy and the role of small-scale farms;Increasing prices for agricultural commodities offer a historic opportunity to intensify production systems for small-scale farmers in many developing countries. But without agricultural policies supporting them in making use of this opportunity, many of them would lose their access to land and income, resulting in aggravated food insecurity.;Prof. Dr Theo Rauch;;DLG-Verlag;Rural21;2013/12;English;"farmers; land access; security of tenure (land); food security; land policies";Land & Food Security;"Access to Land & Tenure Security; Land Policy & Legislation";Global;Journal Articles & Books;http://www.rural21.com/english/current-issue/detail/article/food-security-agricultural-policy-and-the-role-of-small-scale-farms-0000963/;http://www.rural21.com/uploads/media/rural2013_04-S14-17.pdf;http://www.rural21.com/fileadmin/img/content/Issue/En-2013-04/Seite15.jpg;All rights reserved
5;Agricultural policies;Rural21-Vol:47-Nr:4/2013-Article:5;The role of farmers’ organisations in defining national policies;Farmer organisations play a crucial role in the development of rural areas. But how influential are they when it comes to defining national policies? What can they achieve, and where are their limits? Our authors demonstrate this with regard to the small farmer organisations in South Africa.;Langelihle Simela;African Farmers’ Association of South Africa;DLG-Verlag;Rural21;2013/12;English;"farmers; farmers associations; rural development; land policies";;Land Policy & Legislation;South Africa;Journal Articles & Books;http://www.rural21.com/english/current-issue/detail/article/the-role-of-farmers-organisations-in-defining-national-policies-0000962/;http://www.rural21.com/uploads/media/rural2013_04-S18-20.pdf;http://www.rural21.com/fileadmin/img/content/Issue/En-2013-04/Seite18.jpg;All rights reserved
6;Agricultural policies;Rural21-Vol:47-Nr:4/2013-Article:6;How to increase farmer organisations’ effectiveness?;Farmer organisations that deal with policy and advocacy need a lot of specific skills. Exchange programmes with their counterparts in the North can help local farmer organisation in the Souht tap their potential.;"Langelihle Simela; Tinashe Chavhunduka";African Farmers’ Association of South Africa;DLG-Verlag;Rural21;2013/12;English;"farmers; farmers associations; advocacy; development agencies; land management";Land Stakeholders & Institutions;"Land Policy & Legislation; Land Use, Management & Investment";Global;Journal Articles & Books;http://www.rural21.com/english/current-issue/detail/article/how-to-increase-farmer-organisations-effectiveness-0000961/;http://www.rural21.com/uploads/media/rural2013_04-S21-21.pdf;http://www.rural21.com/fileadmin/img/content/Issue/En-2013-04/Seite21.jpg;All rights reserved
7;Agricultural policies;Rural21-Vol:47-Nr:4/2013-Article:7;Envisaging alternative futures for African agriculture;The Future Agricultures Consortium was established in 2005 with support from the UK Department for International Development (DFID) as a learning alliance of leading African and UK-based research organisations. The Consortium provides independent analysis and advice for improving agricultural policy-making. The aim is to encourage critical debate and policy dialogue on the future of agriculture in Africa, elaborating the practical and policy challenges of establishing and sustaining pro-poor agricultural growth.;"Beatrice Ouma; Nathan Oxley";;DLG-Verlag;Rural21;2013/12;English;"agriculture; development agencies; land policies; poverty; rural development";Land Stakeholders & Institutions;Land Policy & Legislation;Africa;Journal Articles & Books;http://www.rural21.com/english/current-issue/detail/article/envisaging-alternative-futures-for-african-agriculture-0000960/;http://www.rural21.com/uploads/media/rural2013_04-S22-23.pdf;http://www.rural21.com/fileadmin/img/content/Issue/En-2013-04/Seite22.jpg;All rights reserved
8;Agricultural policies;Rural21-Vol:47-Nr:4/2013-Article:8;Agricultural policy reform and food security in China;In 1978, the rural reform began in China, and since then farmers, including the poor ones, have benefited from a steady growth in income and gradually strengthened food security. This article explains how China achieved food security in the past three decades, how the reform process has affected poverty reduction and what aims are established to deal with extreme poverty and child malnutrition for the period of 2011–2020.;Zhu Ling;;DLG-Verlag;Rural21;2013/12;English;"land reform; land policies; rural development; agrarian reform; food security; poverty; sustainable development; land management";Land & Food Security;Land Policy & Legislation;China;Journal Articles & Books;http://www.rural21.com/english/current-issue/detail/article/agricultural-policy-reform-and-food-security-in-china-0000959/;http://www.rural21.com/uploads/media/rural2013_04-S24-26.pdf;http://www.rural21.com/fileadmin/img/content/Issue/En-2013-04/Seite24.jpg;All rights reserved
9;Agricultural policies;Rural21-Vol:47-Nr:4/2013-Article:9;FAO’s Monitoring African Food and Agricultural Policies initiative;Policy-makers often lack information and analytical capacity to effectively monitor how policies impact on different stakeholders. The MAFAP initiative of the Food and Agriculture Organization seeks to bridge this gap.;Christian Derlagen ;Food and Agriculture Organization of the United Nations (FAO);DLG-Verlag;Rural21;2013/12;English;"agriculture; food security; land policies; agricultural and rural legislation";"Land Stakeholders & Institutions; Land & Food Security";Land Policy & Legislation;Global;Journal Articles & Books;http://www.rural21.com/english/current-issue/detail/article/faos-monitoring-african-food-and-agricultural-policies-initiative-0000958/;http://www.rural21.com/uploads/media/rural2013_04-S27-27.pdf;http://www.rural21.com/fileadmin/img/content/Issue/En-2013-04/Seite27.jpg;All rights reserved
10;Agricultural policies;Rural21-Vol:47-Nr:4/2013-Article:10;Capacity development for agricultural policy advice;The changes in global agricultural markets over the past decade have major implications on agricultural policy. What are the challenges and opportunities for development-oriented agricultural policy-making? And what advisory capacities are needed to deliver substantive advice to developing countries’ governments? The answers to these questions constitute a new agenda for contemporary capacity development for agricultural policy advice.;Heike Höffler;GIZ;DLG-Verlag;Rural21;2013/12;English;"agriculture; land markets; rural development; land policies; agricultural and rural legislation; capacity building";Land Stakeholders & Institutions;Land Policy & Legislation;Global;Journal Articles & Books;http://www.rural21.com/english/current-issue/detail/article/capacity-development-for-agricultural-policy-advice-0000957/;http://www.rural21.com/uploads/media/rural2013_04-S28-31.pdf;http://www.rural21.com/fileadmin/img/content/Issue/En-2013-04/Seite30.jpg;All rights reserved
