11;Agricultural policies;Rural21-Vol:47-Nr:4/2013-Article:11;"""Each country must define its own priorities""";Many a dogma produced by agricultural policies over the past decades has proved disastrous for African agriculture. Ms Rhoda Peace Tumusiime, Commissioner of Rural Economy and Agriculture of the African Union (AU), looks at lessons learnt and suggests ways to bring progress to Africa’s rural regions.;Rhoda Peace Tumusiime ;;DLG-Verlag;Rural21;2013/12;English;"agriculture; land policies; land governance; rural development; agricultural and rural legislation";;Land Policy & Legislation;Africa;Journal Articles & Books;http://www.rural21.com/english/current-issue/detail/article/each-country-must-define-its-own-priorities-0000956/;http://www.rural21.com/uploads/media/rural2013_04-S32-33.pdf;http://www.rural21.com/fileadmin/img/content/Issue/En-2013-04/Seite33.jpg;All rights reserved
12;Agricultural policies;Rural21-Vol:47-Nr:4/2013-Article:12;‘Smart subsidies’? A critical review of the Malawi fertiliser subsidy programme;Initially hailed a huge success, Malawi’s effort to boost agriculture with fertiliser subsidies appears to have met with failure. The author has a look at what went wrong, arguing that developments must be assessed against the backdrop of politics.;Blessings Chinsinga;;DLG-Verlag;Rural21;2013/12;English;"land governance; land policies; agriculture; agricultural and rural legislation";;Land Policy & Legislation;Malawi;Journal Articles & Books;http://www.rural21.com/english/current-issue/detail/article/smart-subsidies-a-critical-review-of-the-malawi-fertiliser-subsidy-programme-0000955/;http://www.rural21.com/uploads/media/rural2013_04-S34-35.pdf;http://www.rural21.com/fileadmin/img/content/Issue/En-2013-04/Seite34.jpg;All rights reserved
13;Agricultural policies;Rural21-Vol:47-Nr:4/2013-Article:13;Sprouts and microgreens for a nutritious diet;Recent studies have shown that modern breeding for high yield, visual appearance and long shelf life led to an unintentional decline in taste and the content of essential nutrients in vegetables. AVRDC – The World Vegetable Center is studying whether traditional vegetables are more nutritious than modern varieties and whether early growth stages of these vegetables offer consumers a higher content of phytonutrients.;Andreas W. Ebert;;DLG-Verlag;Rural21;2013/12;English;"agriculture; land management; agricultural land management; land policies; land governance; research";Land Stakeholders & Institutions;"Land Policy & Legislation; Land Use, Management & Investment";Global;Journal Articles & Books;http://www.rural21.com/english/current-issue/detail/article/sprouts-and-microgreens-for-a-nutritious-diet-0000952/;http://www.rural21.com/uploads/media/rural2013_04-S42-43.pdf;http://www.rural21.com/fileadmin/img/content/Issue/En-2013-04/Seite42.jpg;All rights reserved
14;Agricultural policies;Rural21-Vol:47-Nr:4/2013-Article:14;Stakeholder participation. Easier said than done;Twenty-seven nations are classified as ‘water scarce’, a further 16 as ‘water stressed’. This situation, coupled with the fact that many surface and groundwater systems are shared between two or more states, has led governments to develop sustainable water management strategies. This implies a real commitment by all water users – households, farmers, and industrialists – to use available supplies in ways that reap sustainable and equitable benefits for all. Drawing on the experience from Mozambique and Zimbabwe, the author discusses some of the challenges of articulating stakeholder participation in a transboundary context.;Dr Lisa Ringhofer;;DLG-Verlag;Rural21;2013/12;English;"water management; natural resources management; water rights; farmers; sustainable land management; land policies";;"Land Policy & Legislation; Land Use, Management & Investment";"Mozambique; Zimbabwe";Journal Articles & Books;http://www.rural21.com/english/current-issue/detail/article/stakeholder-participation-easier-said-than-done-0000954/;http://www.rural21.com/uploads/media/rural2013_04-S36-38.pdf;http://www.rural21.com/fileadmin/img/content/Issue/En-2013-04/Seite36.jpg;All rights reserved
15;Agricultural policies;Rural21-Vol:47-Nr:4/2013-Article:15;Green revolution with black gold;Last year Angola earned 48 billion US dollars from petroleum. Yet the country that was once Africa’s largest agricultural producer is reduced to importing food. Now the government and private investors want to develop the agricultural sector, in the hope that Angola could become a new Brazil. But will there still be room for small-scale farmers?;Klaus Sieg;;DLG-Verlag;Rural21;2013/12;English;"agriculture; rural development; land investments; food security; agricultural land management; agricultural and rural legislation; land policies";"Land & Food Security; Land & Investments; Land Stakeholders & Institutions";"Land Policy & Legislation; Land Use, Management & Investment";Angola;Journal Articles & Books;http://www.rural21.com/english/current-issue/detail/article/green-revolution-with-black-gold-0000953/;http://www.rural21.com/uploads/media/rural2013_04-S39-41.pdf;http://www.rural21.com/fileadmin/img/content/Issue/En-2013-04/Seite39.jpg;All rights reserved
1;Soil - a resource under threat;Rural21-Vol:47-Nr:3/2013-Article:1;Governing the transformation of soils must urgently be improved;We are continuously transforming a resource that is both essential and finite: our soils. We do so in a way that has serious social, economic and ecologic implications. There is an urgent need to shift these transformations to more sustainable pathways. Transgovernance can assume a pivotal role in this regard.;"Klaus Töpfer; Alexander Müller; Jes Weigelt";;DLG-Verlag;Rural21;2013/08;English;"sustainable land management; land governance; land policies";Land, Climate change & Environment;"Land Policy & Legislation; Land Use, Management & Investment";Global;Journal Articles & Books;http://www.rural21.com/english/current-issue/detail/article/governing-the-transformation-of-soils-must-urgently-be-improved-0000835/;http://www.rural21.com/uploads/media/rural2013_03-S06-08.pdf;http://www.rural21.com/fileadmin/img/content/Issue/En-2013-03/07_Grafik_rurale_2013_3.jpg;All rights reserved
2;Soil - a resource under threat;Rural21-Vol:47-Nr:3/2013-Article:2;Awareness, research, action: the Economics of Land Degradation (ELD) initiative;ELD is a joint initiative of Germany, the European Commission and the United Nations Convention to Combat Desertification (UNCCD). ELD offers a strong platform for raising public awareness of land degradation and advocating sustainable land-use strategies.;"Mark Schauer; Lucie Andeltova";GIZ;DLG-Verlag;Rural21;2013/08;English;"sustainable land management; land degradation; advocacy; sustainable land use; land use; development agencies";"Land, Climate change & Environment; Land Stakeholders & Institutions";"Land Policy & Legislation; Land Use, Management & Investment";Global;Journal Articles & Books;http://www.rural21.com/english/current-issue/detail/article/awareness-research-action-the-economics-of-land-degradation-eld-initiative-0000834/;http://www.rural21.com/uploads/media/rural2013_03-S09-09.pdf;http://www.rural21.com/fileadmin/img/content/Issue/En-2013-03/09_Grafik_rurale_2013_3.jpg;All rights reserved
3;Soil - a resource under threat;Rural21-Vol:47-Nr:3/2013-Article:3;A ‘nexus’ approach to soil and land management;Soils around the world are degrading rapidly, reducing ecosystem diversity and some important functions, threatening food and other human securities, and increasing vulnerability to climate change. This is a vicious cycle created by and leading to further unsustainable land-use practices. Integrated (‘nexus’) soil, land, water and ecosystem management can help to turn it into a virtuous cycle.;Holger Hoff;;DLG-Verlag;Rural21;2013/08;English;"sustainable land management; land degradation; food security; climate change; environment; sustainable land use; land use; natural resources management";"Land, Climate change & Environment; Land & Food Security";Land Use, Management & Investment;Global;Journal Articles & Books;http://www.rural21.com/english/current-issue/detail/article/a-nexus-approach-to-soil-and-land-management-0000833/;http://www.rural21.com/uploads/media/rural2013_03-S10-12.pdf;http://www.rural21.com/fileadmin/img/content/Issue/En-2013-03/11_Grafik_rurale_2013_3.jpg;All rights reserved
4;Soil - a resource under threat;Rural21-Vol:47-Nr:3/2013-Article:4;What can conservation agriculture achieve?;Conservation agriculture (CA) is an important form of sustainable land management, provided that the three basic principles - no tillage, permanent soil cover, diverse crop rotation or intercropping - are always observed.;Alexander Schöning;GIZ;DLG-Verlag;Rural21;2013/08;English;"agriculture; sustainable land management";Land, Climate change & Environment;Land Use, Management & Investment;Global;Journal Articles & Books;http://www.rural21.com/english/current-issue/detail/article/what-can-conservation-agriculture-achieve-0000832/;http://www.rural21.com/uploads/media/rural2013_03-S13-13.pdf;http://www.rural21.com/fileadmin/img/content/Issue/En-2013-03/13_Grafik_rurale_2013_3.jpg;All rights reserved
5;Soil - a resource under threat;Rural21-Vol:47-Nr:3/2013-Article:5;Promoting best practices in sustainable land management;Protecting land is vital to achieving food security and reducing poverty. This is the insight on which the global WOCAT network was built two decades ago. WOCAT’s early focus on soil and water conservation has expanded into a tried and tested facility for decision support in all aspects of sustainable land management for every kind of land manager. There is a special focus on providing sustainable benefits for the rural poor, both efficiently and cost-effectively.;"Hanspeter Liniger; Rima Mekdaschi Studer; Isabelle Providoli";;DLG-Verlag;Rural21;2013/08;English;"sustainable land management; food security; poverty; land management; rural development";Land, Climate change & Environment;Land Use, Management & Investment;Global;Journal Articles & Books;http://www.rural21.com/english/current-issue/detail/article/promoting-best-practices-in-sustainable-land-management-0000831/;http://www.rural21.com/uploads/media/rural2013_03-S14-15.pdf;http://www.rural21.com/fileadmin/img/content/Issue/En-2013-03/15_Grafik_rurale_2013_3.jpg;All rights reserved
6;Soil - a resource under threat;Rural21-Vol:47-Nr:3/2013-Article:6;Bio-reclamation – Converting degraded lateritic soils into productive land;Not only has soil degradation in Niger been halted thanks to an integrated approach combining water harvesting technologies, the application of organic residues and planting of fruit trees and vegetables. The strategy has also enabled increases in farmers’ income as well as an active involvement of the country’s largely marginalised women in food production through their gaining access to land.;"Dougbedji Fatondji; Rodolfo Martines Moralez; Saidou Abdoussalam";;DLG-Verlag;Rural21;2013/08;English;"land degradation; sustainable land management; farmers; farming systems; land access; women; gender equity in access to land";"Land & Gender; Land, Climate change & Environment";"Land Use, Management & Investment; Access to Land & Tenure Security";Niger;Journal Articles & Books;http://www.rural21.com/english/current-issue/detail/article/bio-reclamation-converting-degraded-lateritic-soils-into-productive-land-0000830/;http://www.rural21.com/uploads/media/rural2013_03-S16-17.pdf;http://www.rural21.com/fileadmin/img/content/Issue/En-2013-03/16_Grafik_rurale_2013_3.jpg;All rights reserved
7;Soil - a resource under threat;Rural21-Vol:47-Nr:3/2013-Article:7;Rangelands –sound management strategies for a vulnerable resource;Rangelands cover 30 per cent of the global land surface. They support a considerable share of the global ruminant value chains, are habitat for a high plant and animal diversity and have various ecological, economic and social functions. But rangelands are currently under pressure from global change processes. A focus on humananimal- environment interactions is necessary to avoid resource overexploitation and degradation.;"Christian Hülsebusch; Hassan G. Roba; Brigitte Kaufmann";;DLG-Verlag;Rural21;2013/08;English;"rangelands; sustainable land management; environment; land environment; land degradation; intensive land use; land area; natural resources management";"Land, Climate change & Environment; Rangelands, Drylands & Pastoralism";Land Use, Management & Investment;Global;Journal Articles & Books;http://www.rural21.com/english/current-issue/detail/article/rangelands-sound-management-strategies-for-a-vulnerable-resource-0000829/;http://www.rural21.com/uploads/media/rural2013_03-S18-20.pdf;http://www.rural21.com/fileadmin/img/content/Issue/En-2013-03/19_Grafik_rurale_2013_3.jpg;All rights reserved
8;Soil - a resource under threat;Rural21-Vol:47-Nr:3/2013-Article:8;New instruments for better land governance;The livelihoods of many rural dwellers are dependent on having secure and equitable access to land. Tenure security is also a prerequisite for sustainable land management. The massive interest of commercial investors has increased the pressure on land globally. This article describes the international community’s efforts to improve the responsible governance and management of land.;Elisa Manukjan;;DLG-Verlag;Rural21;2013/08;English;"land governance; rural population; rural development; land access; security of tenure (land); sustainable land management; land investments; extractive industries; development agencies";"Land & Investments; Land Stakeholders & Institutions";Access to Land & Tenure Security;Global;Journal Articles & Books;http://www.rural21.com/english/current-issue/detail/article/new-instruments-for-better-land-governance-0000828/;http://www.rural21.com/uploads/media/rural2013_03-S21-23.pdf;http://www.rural21.com/fileadmin/img/content/Issue/En-2013-03/21_Grafik_rurale_2013_3.jpg;All rights reserved
9;Soil - a resource under threat;Rural21-Vol:47-Nr:3/2013-Article:9;Soil conservation in the European Union;Since 2006, a European Union-wide strategy on soil conservation has been in existence that is to address the complex roles that soil plays as a natural resource. However, a legally binding agreement has so far met with opposition by a blocking minority of EU Member States. Does the EU nevertheless offer prospects for soil conservation?;Luca Montanarella;;DLG-Verlag;Rural21;2013/08;English;"land degradation; sustainable land management; environment; natural resources management";"Land, Climate change & Environment; Land Stakeholders & Institutions";Land Use, Management & Investment;Europe;Journal Articles & Books;http://www.rural21.com/english/current-issue/detail/article/soil-conservation-in-the-european-union-0000827/;http://www.rural21.com/uploads/media/rural2013_03-S24-25.pdf;http://www.rural21.com/fileadmin/img/content/Issue/En-2013-03/24_Grafik_rurale_2013_3.jpg;All rights reserved
10;Soil - a resource under threat;Rural21-Vol:47-Nr:3/2013-Article:10;UNCCD – the accord for global land stewardship;With more than 900 million people world-wide affected by chronic hunger, international action on soil conservation is urgently required. The United Nations Convention to Combat Desertification (UNCCD) enjoys substantial support, and the author of this article demonstrates that it could play a key role as a global policy and monitoring framework in addressing land and soil degradation.;Luc Gnacadja;United Nations Convention to Combat Desertification;DLG-Verlag;Rural21;2013/08;English;"land degradation; desertification; land policies; sustainable land management; development agencies";"Land, Climate change & Environment; Land Stakeholders & Institutions";Land Use, Management & Investment;Global;Journal Articles & Books;http://www.rural21.com/english/current-issue/detail/article/unccd-the-accord-for-global-land-stewardship-0000826/;http://www.rural21.com/uploads/media/rural2013_03-S26-27.pdf;http://www.rural21.com/fileadmin/img/content/Issue/En-2013-03/26_Grafik_rurale_2013_3.jpg;All rights reserved
11;Soil - a resource under threat;Rural21-Vol:47-Nr:3/2013-Article:11;Let’s put soils on the global sustainable development agenda;In order to adequately address the important role of soils and land for sustainable development, a holistic approach is needed. This article discusses why biophysical but also socio-economic aspects have to be considered – using the example of Guatemala, one of the first countries to support the proposal to create the Sustainable Development Goals.;Ivonne Lobos Alva;;DLG-Verlag;Rural21;2013/08;English;"sustainable land management; land degradation; land environment; environment; development agencies; sustainable development";"Land, Climate change & Environment; Land Stakeholders & Institutions";Land Use, Management & Investment;Global;Journal Articles & Books;http://www.rural21.com/english/current-issue/detail/article/lets-put-soils-on-the-global-sustainable-development-agenda-0000825/;http://www.rural21.com/uploads/media/rural2013_03-S28-29.pdf;http://www.rural21.com/fileadmin/img/content/Issue/En-2013-03/29_Grafik_rurale_2013_3.jpg;All rights reserved
12;Soil - a resource under threat;Rural21-Vol:47-Nr:3/2013-Article:12;Payments for soil carbon sequestration – “A good incentive for soil conservation”;Soil carbon is important for soil structure and related nutrient and water holding properties. Increasing soil carbon stocks results in improved crop growth and contributes to enhanced climate resilience. In addition, the increase in soil organic carbon through sustainable agricultural land management (SALM) practices, such as the use of cover crops, residue management and agroforestry, will also reduce the need for synthetic nitrogen fertiliser at a given level of crop production. ;Timm Tennigkeit;;DLG-Verlag;Rural21;2013/08;English;"agricultural land management; sustainable land management; land cover; agroforestry systems; farming systems; sustainable land use; environment";Land, Climate change & Environment;Land Use, Management & Investment;Global;Journal Articles & Books;http://www.rural21.com/english/current-issue/detail/article/payments-for-soil-carbon-sequestration-a-good-incentive-for-soil-conservation-0000823/;http://www.rural21.com/uploads/media/rural2013_03-S30-30.pdf;http://www.rural21.com/fileadmin/img/content/Issue/En-2013-03/Tennigkeit.jpg;All rights reserved
13;Soil - a resource under threat;Rural21-Vol:47-Nr:3/2013-Article:13;Payments for soil carbon sequestration – “Smallholders and the climate could lose out”;More than three times as much carbon is stored in soils across the world as it is in the atmosphere, making them one of the most important global carbon sinks. Therefore, processes impacting on the soil in which carbon is released, such as deforestation or agricultural activities, significantly contribute to climate change. The debate on the reduction of greenhouse gas emissions from agricultural activities and their consideration in the international climate negotiations has brought soils as carbon reservoirs more to the public eye.;Marcus Kaplan;;DLG-Verlag;Rural21;2013/08;English;"sustainable land management; farmers; farming systems; agriculture; agricultural land management; environment; climate change; deforestation";Land, Climate change & Environment;Land Use, Management & Investment;Global;Journal Articles & Books;http://www.rural21.com/english/current-issue/detail/article/payments-for-soil-carbon-sequestration-smallholders-and-the-climate-could-lose-out-0000824/;http://www.rural21.com/uploads/media/rural2013_03-S31-31.pdf;http://www.rural21.com/fileadmin/img/content/Issue/En-2013-03/Kaplan.jpg;All rights reserved
14;Soil - a resource under threat;Rural21-Vol:47-Nr:3/2013-Article:14;Why the Green Revolution failed in sub-Saharan Africa;Crop yield improvement is dearly needed in sub-Saharan Africa, but remarkably, African farmers do not adopt the available ‘Green Revolution’ fertiliser technologies. This has many reasons, a crucial one being soil properties.;Roelf L. Voortman;;DLG-Verlag;Rural21;2013/08;English;"farmers; sustainable land management; farming systems";Land, Climate change & Environment;Land Use, Management & Investment;Sub-Saharan Africa;Journal Articles & Books;http://www.rural21.com/english/current-issue/detail/article/why-the-green-revolution-failed-in-sub-saharan-africa-0000822/;http://www.rural21.com/uploads/media/rural2013_03-S32-33.pdf;http://www.rural21.com/fileadmin/img/content/Issue/En-2013-03/33_Grafik_rurale_2013_3.jpg;All rights reserved
15;Soil - a resource under threat;Rural21-Vol:47-Nr:3/2013-Article:15;Integrated Soil Fertility Management – a concept that could boost soil productivity;Soils are naturally poor in sub-Saharan Africa, and poor management has further reduced their productive capacity. The author argues that more fertiliser use is required to reverse further nutrient mining and productivity decline and that this agro-input is best used in combination with other measures to ensure that most of its nutrients are taken up by the crop.;Bernard Vanlauwe;;DLG-Verlag;Rural21;2013/08;English;"sustainable land management; land management; farmers";Land, Climate change & Environment;Land Use, Management & Investment;Sub-Saharan Africa;Journal Articles & Books;http://www.rural21.com/english/current-issue/detail/article/integrated-soil-fertility-management-a-concept-that-could-boost-soil-productivity-0000821/;http://www.rural21.com/uploads/media/rural2013_03-S34-37.pdf;http://www.rural21.com/fileadmin/img/content/Issue/En-2013-03/Acloserlook_Soilfertility.jpg;All rights reserved
16;Soil - a resource under threat;Rural21-Vol:47-Nr:3/2013-Article:16;Experience with the System of Rice Intensification in Timor Leste;The System of Rice Intensification (SRI) is a natural resource management technology that has supporters and opponents. Evidence of the technology’s impacts is mixed. Recent research results from Timor Leste suggest that SRI can improve yields and incomes of smallholder farmers when proper extension systems are in place.;"Martin Noltze; Stefan Schwarze; Matin Qaim";;DLG-Verlag;Rural21;2013/08;English;"natural resources management; land management; sustainable land management; farmers; farming systems";Land, Climate change & Environment;Land Use, Management & Investment;Timor Leste;Journal Articles & Books;http://www.rural21.com/english/current-issue/detail/article/experience-with-the-system-of-rice-intensification-in-timor-leste-0000820/;http://www.rural21.com/uploads/media/rural2013_03-S38-40.pdf;http://www.rural21.com/fileadmin/img/content/Issue/En-2013-03/38_Grafik_rurale_2013_3.jpg;All rights reserved
17;Soil - a resource under threat;Rural21-Vol:47-Nr:3/2013-Article:17;Revival for Zimbabwe’s meat market;Zimbabwe used to be well-known for its high-quality meat exports. The sector was hard hit by the economic crisis that set in during the 1990s and coincided with the impact of a failed land reform and recurrent drought. Now, a new livestock-fattening scheme is to contribute to the survival of the branch and help resource-poor smallholders earn a living by marketing their meat.;"Rüdiger Behrens; Marjorie Chaniwa; Indira Maturure; Roy Miller";;DLG-Verlag;Rural21;2013/08;English;"environment; land reform; land environment; farming systems; sustainable land management";Land, Climate change & Environment;Land Use, Management & Investment;Zimbabwe;Journal Articles & Books;http://www.rural21.com/english/current-issue/detail/article/revival-for-zimbabwes-meat-market-0000819/;http://www.rural21.com/uploads/media/rural2013_03-S41-43.pdf;http://www.rural21.com/fileadmin/img/content/Issue/En-2013-03/41_Grafik_rurale_2013_3.jpg;All rights reserved
1;Responsible use of forests;Rural21-Vol:45-Nr:2/2011-Article:1;Madrid High-Level Meeting on Food Security for All;At the High-Level Meeting on Food Security for All hosted in early January 2009 by the Spanish government in Madrid, stakeholders from more than 126 countries deliberated how to assure food security for all in developed and developing countries alike. The high level meeting carried forward the process launched by the June 2008 Rome food summit. Its purpose was to accelerate progress in meeting MDG 1 and address the effects of price fluctuations in vulnerable populations. The final report established the following outcomes:;Silvia Richter;;DLG-Verlag;Rural21;2011/03;English;"food security; forest land; forestry; land management; development agencies";"Land & Food Security; Forest Tenure; Land Stakeholders & Institutions";Land Use, Management & Investment;Global;Journal Articles & Books;http://www.rural21.com/english/archiv-2005-2011/archive2011-02en/world-food-crisis/madrid-high-level-meeting-on-food-security-for-all/;;;All rights reserved
2;Responsible use of forests;Rural21-Vol:45-Nr:2/2011-Article:2;The response of FIAN International;The outcome of the Madrid High-Level Meeting on Food Security can be considered a victory for those who want to see the multilateral governance of the global food and agriculture system improved and strengthened, and conducted within the Right to Adequate Food framework.;Flavio Luiz Schieck Valentex;FIAN International;DLG-Verlag;Rural21;2011/03;English;"food security; land governance; agricultural land management; agriculture; forest land";"Land & Food Security; Forest Tenure; Land Stakeholders & Institutions";Land Use, Management & Investment;Global;Journal Articles & Books;http://www.rural21.com/english/archiv-2005-2011/archive2011-02en/world-food-crisis/the-response-of-fian-international/;;;All rights reserved
