"uasm:3406";"Consolidarea terenurilor agricole în procesul de dezvoltare durabilă în comuna Sărata veche raionul Făleşti cu aplicarea tehnicilor SIG";;"Land consolidation is a planned readjustment and rearrangement of land parcels and their ownership. It is usually applied to form larger and more rational land holdings. Land consolidation can be used to improve the rural infrastructure and to implement the developmental and environmental policies. The need to improve land management is obvious. Due to this, in this study special attention is paid to rural areas where land relations have profound implications for agricultural productivity, environmental sustainability and the economic and social status of rural households. The recent and dramatic shift from a centrally planned to a market-based economy has emphasized the urgent need for the designing of an effective framework to promote a smooth and effective transition to agriculture land tenure relations consistent with market-oriented development.";"Cucorean, Tatiana
Cucorean, Sergiu
Moraru, Teodor";;;"Republican Scientific Agricultural Library of the State Agrarian University of Moldova";"2013-12-31";"ro";"farmland;land consolidation;sustainable development";"Socio-Economic & Institutional Context";"001";"Journal Articles & Books";"http://dspace.uasm.md/handle/123456789/3406";"http://dspace.uasm.md/rest/bitstreams/5aad9210-5fde-420d-a3f0-8f389f476c8e/retrieve";;;;;;"uasm:3406"
"uasm:4690";"Developing land consolidation concept and strategy in the Republic of Moldova";;"In the paper short data on the results of implementation of pilot land consolidation projects in 6 villages of the Republic of Moldova in 2007-2009 are presented. As a result it became possible to accumulate the experience necessary for extension of these works in scales of all country. Simultaneously a number of difficulties and problems have been identified. It will be difficult to realize these works without elimination of them. In Moldova in 2008 the Government has accepted the Program of land consolidation that was premature step because pilot projects haven't been still implemented, the Concept hasn't been confirmed and Strategy of land consolidation hasn't been developed. Therefore at the present stage it is necessary to concentrate efforts on developing the land consolidation Concept and Strategy and on improvement of actual legal framework in this field. In the paper the author who participated in implementation of these 6 pilot projects offers some ideas concerning this problem. The factors constraining implementation of land consolidation are considered and some measures on their elimination are recommended. A number of theoretical and practical problems demanding examination and solution in the future are considered. First of all, it is necessary to answer to the question: what we want to realize-land consolidation or land reparcelling. Then in Strategy it is necessary to define: either land consolidation should be completely voluntary or particularly or comprehensive compulsory and how in this case one may apply economic levers to accelerate this process; what are the limits of the state intervention in regulation of land relations in modern conditions; whether it is necessary to limit the sizes of land ownerships, etc. Also it is necessary to establish Land Bank and united state entity responsible for land consolidation, to identify the demand of land consolidation specialists and to organize their training by launching education courses, to develop land market, to amend legal provisions on land consolidation, to determine sources and to develop administrative rules for financing land consolidation projects.";"Horjan, Oleg";;;"Republican Scientific Agricultural Library of the State Agrarian University of Moldova";"2011-12-31";"en";"land consolidation;land reform";"Socio-Economic & Institutional Context";"MDA";"Journal Articles & Books";"http://dspace.uasm.md/handle/123456789/4690";"http://dspace.uasm.md/rest/bitstreams/01cd80d0-c832-4309-9d65-dbbeda1daeb4/retrieve";;;;;;"uasm:4690"
"uasm:4271";"Dimensiunea teritorială a exploataţiilor agricole în contextul economiei dezvoltării";;"Experience in many countries demonstrates that without a clear land policy, it will be difficult or impossible to reduce deep-rooted structural poverty and inequality. The objective of the paper is to investigate the size of family farms in Moldova and other countries in the context of the development economics. In this context, the major factors that determine the farm size are analyzed: placement, inequality of income, average area per 1 inhabitant, and GDP per 1 inhabitant. It has been established that the average farm size is determined basically by the level of development of the countries: the most developed countries have larger farms then developing countries. Also, the topics of land concentration and the duality of farm structure have been investigated. “Medium-sized” family farms, the backbone of any market agriculture, virtually do not exist in Moldova. Moldovan agriculture is characterized by a much greater concentration of land in large farms than agriculture in market economies. Building on a wide array of research and experience, this paper lays out the main dimensions of the issue and illustrates how they can help to develop an approach to land policy that fits into more general strategies for poverty reduction.";"Cimpoieș, Dragoș";;;"Republican Scientific Agricultural Library of the State Agrarian University of Moldova";"2012-12-31";"ro";"land policies";"Land Stakeholders & Institutions";"MDA";"Journal Articles & Books";"http://dspace.uasm.md/handle/123456789/4271";"http://dspace.uasm.md/rest/bitstreams/34d3980e-1d9e-4dbd-9420-16f3575e6573/retrieve";;;;;;"uasm:4271"
"uasm:2920";"Probleme cu privire la elaborarea sistemelor informatice specifice domeniilor de activitate din Republica Moldova";;"The purpose of this article is to analyze the state of the IT systems specific to different areas of activity in the Republic of Moldova, aiming at informational provision, permanent monitoring and facilitation of the decision-making processes for sustainable development. The technical, economic, legal, social, methodological aspects of the elaboration and implementation of the specific IT systems as subsystems for the recording and management of real estate are studied.";"Popescul, Sergiu
Turculeț, Mihail";;;"Republican Scientific Agricultural Library of the State Agrarian University of Moldova";"2018-12-31";"ro";"cadastres;land management;sustainable development";"Land Stakeholders & Institutions;Socio-Economic & Institutional Context";"MDA";"Journal Articles & Books";"http://dspace.uasm.md/handle/123456789/2920";"http://dspace.uasm.md/rest/bitstreams/b0899561-ba49-426d-9890-c6acdf35fa5b/retrieve";;;;;;"uasm:2920"
"uasm:3669";"Răspunderea juridică pentru încălcarea legislației funciare";;"In that article it made an analysis of land legislation and legal doctrine on the liability of infringement and violation of rights of land that have connection with the land. The complexity of the investigation was expressed through forms of legal liability for illicit facts which are covered by several branches of law.";"Bontea, Larisa";;;"Republican Scientific Agricultural Library of the State Agrarian University of Moldova";"2016-12-31";"ro";"land law";;"001";"Journal Articles & Books";"http://dspace.uasm.md/handle/123456789/3669";"http://dspace.uasm.md/rest/bitstreams/3dc5e6d0-a2f4-4af5-b29d-926cbf330dd9/retrieve";;;;;;"uasm:3669"
"uasm:2936";"Analiza cantitativă a sectoarelor de teren agricol din satul Corjeuți, raionul Briceni";;"This article presents a synthesis of analysis of how to use the most valuable natural

resourses-agricultural lands in Corjeuti village Briceni district. Agricultural land use patterns are studied and consolidation measures proposed to optimize spending, increase productivity, and sustainable development for the future. The peculiarities of the consolidation of the agricultural land from the localities in the northern part of the republic were examined in organizational, technical and legal terms. Also, the materials of the projects developed in this region have been consulted, identified some problems that will improve the situation.The study is based on the vision of rural use, the efficient use of natural resources, and the preservation of the environment for sustainable development.";"Popescul, Sergiu
Turculeț, Mihail";;;"Republican Scientific Agricultural Library of the State Agrarian University of Moldova";"2018-12-31";"ro";"agriculture;cadastres;farmland;land consolidation";;"MDA";"Journal Articles & Books";"http://dspace.uasm.md/handle/123456789/2936";"http://dspace.uasm.md/rest/bitstreams/219de9ce-b6d6-437a-b49c-ac41e623e040/retrieve";;;;;;"uasm:2936"
"uasm:2930";"Arenda funciară ca mecanism efectiv de reparcelare a terenurilor agricole în Republica Moldova";;"The article isfocused on the investigation ofland re-parceling through land leasemarket development in Moldova. First, it describes land lease market development in Moldova and its impact on land re-parceling. Second, it analyzes strategies adopted by the agricultural farms regarding the participation in land lease and reasons why people lease land. And finally, it examines the problems of lease term and lease payment.";"Cimpoieș, Dragoș";;;"Republican Scientific Agricultural Library of the State Agrarian University of Moldova";"2011-12-31";"ro";"land consolidation;land markets";"Land & Investments";"MDA";"Journal Articles & Books";"http://dspace.uasm.md/handle/123456789/2930";"http://dspace.uasm.md/rest/bitstreams/58c558ae-f7a7-4d4d-9d2f-5d7b94cace6f/retrieve";;;;;;"uasm:2930"
"uasm:5074";"The influence of land relations on the legal forms of organization";;"The paper addresses a current issue related to the agricultural land relations of the Republic of Moldova. The analysis of the current stage of situation proves the priority of the private property in the agricultural land belonging to the legal forms of organization in comparison with the areas of the leased agricultural lands. Land relations reform in agriculture aimed at the privatization of land and other agricultural goods and implementation of market land relations. Agriculture in the Republic of Moldova is dominated by several legal forms of organization based on both associative and individual principles. Each of these forms requires a separate study. The paper is focused on the main legal forms of organization and namely: private limited companies (Ltd) and peasant (farmer type) farms. Agriculture is an area in which the legal forms of organization have been most influenced by the process of land reform. The reform has changed the economic essence of the production process in agriculture - the property. International experience in this field has demonstrated the effectiveness and priority of the agricultural farms’ potential based on individual principles, especially those of a family type. The study proves the interaction between property rights and process of agriculture intensification through investments, especially those aimed at the development of vineyard and orchard plantations.";"Zubco, Efim
Botnarenco, Ion
Mocreac, O.";;;"Republican Scientific Agricultural Library of the State Agrarian University of Moldova";"2018-12-31";"en";"cadastres;land ownership;land reform";"Socio-Economic & Institutional Context";"MDA";"Journal Articles & Books";"http://dspace.uasm.md/handle/123456789/5074";"http://dspace.uasm.md/rest/bitstreams/d2bac684-ea39-40ca-b1df-40b1c6afada0/retrieve";;;;;;"uasm:5074"
"uasm:3770";"Eficienţa economică a activităţii gospodăriei agricole consolidate în comuna Găuzeni raionul Șoldăneşti";;"The article argues the need for land consolidation in Moldova. Were examined two variants of activity of the farm household in the village Găuzeni district Şoldăneşti. Or led economic indicators that allow consolidated management of the farm household to choose the direction of activity.";"Moraru, Teodor";;;"Republican Scientific Agricultural Library of the State Agrarian University of Moldova";"2011-12-31";"ro";"agrarian reform;land consolidation";;"MDA";"Journal Articles & Books";"http://dspace.uasm.md/handle/123456789/3770";"http://dspace.uasm.md/rest/bitstreams/17c48e33-1a95-424c-9326-b23ad6b47641/retrieve";;;;;;"uasm:3770"
"uasm:3549";"Comparative analysis of the land fragmentation and its impact on the farm management in some eu countries and Moldova";;"The paper presents selected problems of farm management in terms of fragmented agriculture. The problem of land fragmentation was exemplified by the three countries of Central and Eastern Europe. The main purpose of the study was to compare the effectiveness of selected indicators of agricultural production in the three selected countries. For the analysis, the data on the concentration indexes was selected: Lorenz concentration coefficient, the Gini index, and territorial concentration coefficient (Gini C and Stuck formula). In selected countries, there is a large number of small and very small farms. They represent the majority of farms managed by private owners. To a large extend, they are called semi-subsistence farms or social farms. Some of them provide a part of their products on the market. Small farms are the part of the so-called European Model of Agriculture – a model that consists of small family farms. It is difficult to indicate correct definition of „small farm”, as it may be defined differently depending on the region or country. In the EU, small farms occupy a dominant position, being a constant subject of debates and policy. The authors of the article stressed the need of strengthening of the small farms position, for example by enlarging their acreage or by initiating horizontal or vertical cooperation, however, shall not impair the role of small farms. They are important in biodiversity protection, preserving the rural landscape, as well as by cultivation local tradition, culture and heritage.";"Kielbasa, Barbara
Popa, Daniela
Timofti, Elena";;;"Republican Scientific Agricultural Library of the State Agrarian University of Moldova";"2015-12-31";"en";"land productivity";"Land & Investments";"MDA";"Journal Articles & Books";"http://dspace.uasm.md/handle/123456789/3549";"http://dspace.uasm.md/rest/bitstreams/d9d656d4-ff57-496f-8676-9e9169f328d4/retrieve";;;;;;"uasm:3549"
"uasm:4459";"Land banking as a financial and management tool for the price dynamics determinants in Moldavian real estate market";;"This paper analyzes the land market in republic of Moldova. Since its independence in 1991, the land market has a tendency to be used for agricultural purposes.

Also, the country is described au agricultural economy which is the main reasou why the focus of this study is ou land prices for agricultural purposes.";"Litvin, Aurelia
Karataş, Muhammed
Buzulan, M.";;;"Republican Scientific Agricultural Library of the State Agrarian University of Moldova";"2019-12-31";"en";"land markets";"Land & Investments";"MDA";"Journal Articles & Books";"http://dspace.uasm.md/handle/123456789/4459";"http://dspace.uasm.md/rest/bitstreams/edeef10e-e6b7-4ef0-9279-03e353f6cdff/retrieve";;;;;;"uasm:4459"
