"uasm:3661";"Colaborarea Republicii Moldova cu Organizaţia Naţiunilor Unite pentru Alimentaţie și Agricultură (F.A.O.)";;"In this article the author has aimed a study on F.A.O. regarding historical aspects of formation F.A.O. as a specialized agency of the UN, analysis directions of its activity, its main functions etc. The author also aims to examine specific issues related to cooperation between F.A.O. and Moldova, directions and areas of cooperation, the development of these relations, the legislation which materializes the legal relations of collaboration and the benefits they had the Republic of Moldova as a result of collaboration with F.A.O.";"Bontea, Oleg";;;"Republican Scientific Agricultural Library of the State Agrarian University of Moldova";"2016-12-31";"ro";"agriculture;climate change;land reform;rural development";"Land, Climate Change & Environment;Socio-Economic & Institutional Context";"MDA";"Journal Articles & Books";"http://dspace.uasm.md/handle/123456789/3661";"http://dspace.uasm.md/rest/bitstreams/a7ecb81c-2448-4305-b6f7-d6c0939e4180/retrieve";;;;;;"uasm:3661"
"uasm:3923";"Difficultăţile gestionării resurselor funciare in Republica Moldova";;"The article exposed the structure and land resource management issues

worldwide. Also, it explains the difficulties of effective management of land in Moldova

and the factors that generate them: high fragmentation of land, failure to comply with the

technological processing rules of the land, short-term lease etc.";"Prisăcaru, Veronica";;;"Republican Scientific Agricultural Library of the State Agrarian University of Moldova";"2010-12-31";"ro";"arable land;farmland;land management";"Land Stakeholders & Institutions";"MDA";"Journal Articles & Books";"http://dspace.uasm.md/handle/123456789/3923";"http://dspace.uasm.md/rest/bitstreams/25e56323-90bb-4bb1-96e7-36e3b9bd7395/retrieve";;;;;;"uasm:3923"
"uasm:5295";"Particularitățile metodologice ale reglementării relaţiilor funciare agrare în Republica Moldova";;"Relațiile funciare, începând cu etapa inițială a dezvoltării statului, reprezintă un product al societății. În istoria statalității Republicii Moldova se vor găsi mai multe etape inițiale. Este important a sublinia că, indiferent de acest fapt, relațiile funciare au fost printre primele și cele mai importante în dezvoltarea societății. Prin aceasta, se constată și conținutul social al relațiilor funciare. Perioada vizată în prezentul studiu, include etapa stabilirii statalității Republicii Moldova, anii 1991-2018 – perioadă în care are loc formarea unor relații funciare evidente. Perioada anilor 1991-1995 se caracterizează printr-o modificare intensivă a relaţiilor funciare, mai ales în domeniul agricol. Cu cât ne îndepărtăm mai mult de evenimentele ce au avut loc în această perioadă, cu atât mai mult sunt necesare studii profunde referitoare la influenţa acţiunilor realizate în cadrul ei asupra prezentului şi, nu mai puţin, a viitorului. Practica prea modestă a Republicii Moldova, în ce privește nivelul de performanță a relaţiilor funciare, apreciată în ansamblu cu practica mondială, ne convinge de importanţa majoră a relaţiilor funciare în procesul creării cadastrului, de rolul conceptual al ambelor în dezvoltarea economiei ţării. Lozinca „fără cadastru nu există economie, este recunoscută în cadrul implementării şi dezvoltării politicilor economice, a societăţii în ansamblu.";"Zubco, Efim";;;"Republican Scientific Agricultural Library of the State Agrarian University of Moldova";"2020-12-31";"ro";"cadastres;land law;land markets;rural areas";"Land & Investments;Socio-Economic & Institutional Context";"001";"Reports & Research";"http://dspace.uasm.md/handle/123456789/5295";"http://dspace.uasm.md/rest/bitstreams/fd841c93-8c98-4c6b-a253-b61f636a2609/retrieve";;;;;;"uasm:5295"
"uasm:4969";"The multi-factorial regression models for studying the economic efficiency of land consolidation in the Republic of Moldova";;"The purpose of this paper is to study the economic efficiency of the autumn wheat with the help of the multi-factorial regression models. Assessing the elasticity coefficient of production factors in the agrarian sector of the Republic of Moldova gives the possibility to define the criteria for optimizing the land consolidation. By means of these assessment methods we can appreciate the existence, direction and the degree of interrelatedness between the economic processes. We can also measure the degree of variation of endogenous characteristics under the influence of the exogenous characteristics in growing autumn wheat in the district of Făleşti, the Republic of Moldova.";"Cimpoieș, Dragoș
Racul, Anatol";;;"Republican Scientific Agricultural Library of the State Agrarian University of Moldova";"2011-12-31";"en";"land consolidation";;"MDA";"Journal Articles & Books";"http://dspace.uasm.md/handle/123456789/4969";"http://dspace.uasm.md/rest/bitstreams/c46b71c9-57ed-4bf9-a16a-cfc0e111915f/retrieve";;;;;;"uasm:4969"
"uasm:3157";"Reforma agrară: concept şi realităţi";;"The study ""Land reform: concept and achievements"" the authors Simion Certan and Ion Certan meditate on achieving conception of agrarian reform and social - economic development of the village in Moldova, approved on 15 February 1991 in the Parliament Decision no. 510-a-XII. According to The concept Moldovan government was suposed to make the ""land reform, management reform and economic relations agroindustrial complex, providing material, technical and scientific assistance and staffing agro-industrial complex, will help develop social-economic development of the village"". Today, after almost a quarter century, we come with a modest study on reform achievements, the successes and failures, the impact of reform on agriculture and rural development which determines the timelines of this material.";"Certan, Simion";;;"Republican Scientific Agricultural Library of the State Agrarian University of Moldova";"2015-12-31";"ro";"agrarian reform;farmland;land consolidation;land reform;private ownership;rural development";"Socio-Economic & Institutional Context";"MDA";"Journal Articles & Books";"http://dspace.uasm.md/handle/123456789/3157";"http://dspace.uasm.md/rest/bitstreams/9901bc5a-f700-4428-ba14-1a3a17fe3268/retrieve";;;;;;"uasm:3157"
"uasm:2459";"Technical remediation and improvement activities of land use based on deforestation and levelling-modeling in the Republic of Moldova";;"Land improvement activities contribute to soil protection, create conditions to boost soil fertility and encourage more rational use of water resources. The paper is focused on investigating, planning, performing and maintaining the constructions related to water use or protection against destructive actions. The soil – being the main natural source of the Republic of Moldova and forming the base of its food security, economic potential and people welfare – becomes increasingly the subject to severe degradation processes in recent years. One of the main degradation processes is land erosion. This paper provides technical remediation and improvement activities for agricultural land use in the village Parcani, Soroca district.";"Mocreac, Viorica";;;"Republican Scientific Agricultural Library of the State Agrarian University of Moldova";"2018-12-31";"en";"land improvement";"Forest Landscape Restoration";"MDA";"Journal Articles & Books";"http://dspace.uasm.md/handle/123456789/2459";"http://dspace.uasm.md/rest/bitstreams/9e990c0c-4add-4427-bce3-64a9532457a9/retrieve";;;;;;"uasm:2459"
"uasm:3430";"Particularităţile juridice privind instituţia înstrăinarii bunurilor cu destinaţie agricolă";;"Timeliness and the purpose of this article consists in the carrying out of an investigation of complex problems arising from practicing institution disposal of goods intended for agriculture, through the prism of analysis rules governing this matter, leveraging in this respect and legal framework doctrinaire approaches in this field, as well as for the formulation of solutions and proposals for improvement of legislation governing the institution disposal of goods.The main objectives of this article are: defining and creating the concept maintenance condition goods intended for agriculture in the context of the framework in which it is out of question; research aspects of as compared to legal as regards regulating the disposal of goods intended for agriculture effects of these legal acts civil.";"Tălămbuță, Angelina";;;"Republican Scientific Agricultural Library of the State Agrarian University of Moldova";"2013-12-31";"ro";"land law";;"001";"Journal Articles & Books";"http://dspace.uasm.md/handle/123456789/3430";"http://dspace.uasm.md/rest/bitstreams/49b9152d-8eda-4aa6-9e70-e9c10dc098df/retrieve";;;;;;"uasm:3430"
"uasm:4821";"Trends and possible perspectives of moldavian’s farms";;"Agriculture is an integral part of the world food system. Because of the rapid growth in world population, increasing food output will receive greater attention in future years. The dilemma involves the entire food sector, from farm supply to farming and ranching to food processing and distribution. Republic Moldova’s agriculture accounts for approximately 35% of the GDP and with food processing industry added, as much as 46%. 42% of active labor force is involved in the agriculture sector. In the given work the author studies the land resources use of farms from Republic of Moldova.";"Popa, Daniela";;;"Republican Scientific Agricultural Library of the State Agrarian University of Moldova";"2008-12-31";"en";"land management";"Land Stakeholders & Institutions";"MDA";"Journal Articles & Books";"http://dspace.uasm.md/handle/123456789/4821";"http://dspace.uasm.md/rest/bitstreams/a0bf264b-b678-40c9-b416-fa51ff24aabb/retrieve";;;;;;"uasm:4821"
"uasm:4762";"Land – price determinants using the spatial econometrics modeling in the Moldavian real estate";;"The purpose of this paper is to determine the factors which influence the land market in Republic of Moldova. The paper aims to discover the determinants for land pricing using the spatial econometrics modeling, as it is widely used when the spatial component is present. The country’s agricultural economy combined with the interest of international organizations and limited data availability directed the focus of this empirical study towards land for agricultural purposes. The factors which determine the land market (for agricultural purposes) in Republic of Moldova are mainly related to economic characteristics of land, such as field productivity, the position on the local landscape (characterized by angle and soil quality), proximity to local or national roads (due to storage and transportation reasons), and economic characteristics of owners. Also, another important role in land market price creation is the pressure of urban space to transform land for agricultural use close to cities and villages in spaces for industrial or residential purposes. This is characterized by the financial pressure from the urban centers which has become significant in land transactions.";"Cimpoieș, Dragoș
Racul, Anatol";;;"Republican Scientific Agricultural Library of the State Agrarian University of Moldova";"2012-12-31";"en";"land markets";"Land & Investments";"MDA";"Journal Articles & Books";"http://dspace.uasm.md/handle/123456789/4762";"http://dspace.uasm.md/rest/bitstreams/cfa9744e-b71a-4202-9852-1575061fc75c/retrieve";;;;;;"uasm:4762"
"uasm:5018";"Directions for efficient use of land fund fruit growing in the Republic of Moldova";"Direcţiile utilizării eficiente a fondului funciar în pomicultura Republicii Moldova";"Results are exposed on land use efficiency in fruit growing. We propose several directions for improving land use through the establishment of productive perennial plantations in the Republic of Moldova. 

Se expun rezultatele referitor la eficienţa utilizării fondului funciar în pomicultură. Se propun câteva direcţii de ameliorare a utilizării fondului funciar prin înfiinţarea plantaţiilor perene productive în Republica Moldova.";"Barbaroș, Ecaterina
Barbaroș, Ion";;;"Republican Scientific Agricultural Library of the State Agrarian University of Moldova";"2011-12-31";"en";"land management";"Land Stakeholders & Institutions";"MDA";"Journal Articles & Books";"http://dspace.uasm.md/handle/123456789/5018";"http://dspace.uasm.md/rest/bitstreams/41d001db-13ed-4490-a71d-f92faefc858d/retrieve";;;;;;"uasm:5018"
"uasm:3999";"Land – price determinants in moldavian real estate market.";;"În acest articol este evaluat mecanismul de piaţă a operaţiilor de vânzare – cumpărare a terenurilor agricole în Republica Moldova. Analiza pieţei funciare în ţările CentralEuropene atestă proceduri macroeconomice specifice de formare a preţurilor terenurilor agricole.

Aceste proceduri presupun utilizarea matricelor standartizate de adiacenţă (SAM) ca o componentă

de bază a metodei econometriei spaţiale. Componenta spaţială SAM în analiza regresională

defineşte gradul de vecinătate a parcelelor incluse în relaţia funcţională între variabilele endogene

şi cele exogene. Evaluarea preţului terenurilor agricole în dependenţă de componenta spaţială s-a

efectuat pe un eşantion de 199 unităţi agricole. În cadrul studiului este argumentată necesitatea

creării Băncii Funciare a Republicii Moldova.";"Dragan, Tudor
Danilov, Iurie
Danilov, Anatolie
Racul, Iulian";;;"Republican Scientific Agricultural Library of the State Agrarian University of Moldova";"2012-12-31";"en";"farmland;land markets";"Land & Investments";"MDA";"Journal Articles & Books";"http://dspace.uasm.md/handle/123456789/3999";"http://dspace.uasm.md/rest/bitstreams/1c8315c4-e19f-4dd6-adc3-8a9368ec39d4/retrieve";;;;;;"uasm:3999"
"uasm:3323";"Contribuţia Catedrei ,, Îmbunătăţiri funciare şi fizică” la dezvoltarea lucrărilor de îmbunătăţiri funciare în Republica Moldova";;"During its existence the Department „Iand improvements and Phisica” carried out activities not only teaching, but alco scientific, contributing to the development of land improvement works in Moldova.";"Coșuleanu, Teodor";;;"Republican Scientific Agricultural Library of the State Agrarian University of Moldova";"2013-12-31";"ro";"land improvement";"Forest Landscape Restoration";"MDA";"Journal Articles & Books";"http://dspace.uasm.md/handle/123456789/3323";"http://dspace.uasm.md/rest/bitstreams/8dee04da-c99c-449e-8cea-14eda0bfc78f/retrieve";;;;;;"uasm:3323"
"uasm:4117";"Repere şi rezultate ale activităţii agriculturii Uniunii Europene";;"The economic estimation of the production activity in agriculture represents an economic category, which express the capacity to produce economic effects with lowest labour costs. In fact, the economic estimation refers to the whole economic activity and, as a result, both to the material production sphere, to the process of production distribution and circulation, as well as to various forms of economic activities from the non-productive sphere. This is a very strong connection between the last one and the net profit as a difference between the final production and the total production costs, which refer to the factors that the enterprising must procure on the market.";"Gherman, Olimpiu";;;"Republican Scientific Agricultural Library of the State Agrarian University of Moldova";"2012-12-31";"ro";"agriculture;land management;land policies;natural resources";"Land Stakeholders & Institutions;Land, Climate Change & Environment";"001";"Journal Articles & Books";"http://dspace.uasm.md/handle/123456789/4117";"http://dspace.uasm.md/rest/bitstreams/400462f8-71a3-4932-8c92-eaa3c9b329db/retrieve";;;;;;"uasm:4117"
"uasm:3502";"Principiile de determinare a eficienţei consolidării terenurilor agricole";;"In the article the results of the agrarian reform in the village Semionovca from Stefan Voda district were examined. There has been studied the project of a small peasant farm for one plot of land and the elements of the land use and land management. Some economic parameters were determined in order to demonstrate the efficiency of land consolidation.";"Moraru, Teodor";;;"Republican Scientific Agricultural Library of the State Agrarian University of Moldova";"2006-12-31";"ro";"farmland;land consolidation";;"001";"Journal Articles & Books";"http://dspace.uasm.md/handle/123456789/3502";"http://dspace.uasm.md/rest/bitstreams/4893d72c-2d26-4e25-9925-16308f6053dc/retrieve";;;;;;"uasm:3502"
"uasm:4811";"Lessons from development strategies: socio-economic impacts of land policy in the Republic of Moldova";;"In this paper, the author considers the impacts of land reform on privatization and ownership structure of agricultural land, as well as on agricultural and rural developments. The analysis is based on official statistical sources, data and results of several questionnaire-based surveys. The main idea of the paper – it is necessary to flow the land from large corporate farms to small family farms, until equilibrium will not be created between those two farm sectors, as is commonly observed in market economies.";"Cimpoieș, Dragoș";;;"Republican Scientific Agricultural Library of the State Agrarian University of Moldova";"2007-12-31";"en";"land policies";"Land Stakeholders & Institutions";"MDA";"Journal Articles & Books";"http://dspace.uasm.md/handle/123456789/4811";"http://dspace.uasm.md/rest/bitstreams/3337d45d-e760-43f7-8dde-1a3f5fdb3837/retrieve";;;;;;"uasm:4811"
"uasm:2954";"Problemele relațiilor funciare în agricultura Moldovei";;"Acest articol este consacrat domeniului relațiilor funciare, în special celor agricole

și problemelor legate de reglementarea eficientă a lor în condițiile actuale ale dezvoltării societății. Din totalitatea problemelor nesoluționate în agricultura Republicii Moldova la etapa actuală autorul subliniază necesitatea obiectivă a dezvoltării bazelor metodologice a relațiilor funciare agrare, în scopul administrării durabile a resurselor funciare de către forme organizatorico-juridice, bazate pe diferite tipuri de proprietate.

Relațiile funciare reprezintă un product al societății. În istoria statalității Republicii Moldova

vom găsi mai multe etape de dezvoltare a relațiilor funciare. Perioada prezentului studiu include ultima etapă inițială a statalității Republicii Moldova, perioada anilor 1991-2018 – o perioada destinată pentru formarea unor relații funciare pronunțate.";"Zubco, Efim
Botnarenco, Ion";;;"Republican Scientific Agricultural Library of the State Agrarian University of Moldova";"2018-12-31";"ro";"cadastres;land reform;land use";"Land, Climate Change & Environment;Socio-Economic & Institutional Context";"MDA";"Journal Articles & Books";"http://dspace.uasm.md/handle/123456789/2954";"http://dspace.uasm.md/rest/bitstreams/ed8e04e1-55f3-428c-a561-b6733f106960/retrieve";;;;;;"uasm:2954"
"uasm:2995";"Theoretical aspects regarding the „person” in land law legal relations";;"In land law, legal norms are regulating land legal relations, which represent a complex of relations that appear between the landowners in the process of land use. Those who are under the legal norm find in its content the „model” of behaviour they must have, whether a certain action or abstention is required from them or if they are allowed to do or not to do something. Land legislation determines a particular notion regarding the subjects participating in land relations. Subjects of land relations are the landowners, natural persons and legal persons, public authorities in the process of land use.";"Baltaga, Ecaterina";;;"Republican Scientific Agricultural Library of the State Agrarian University of Moldova";"2017-12-31";"en";"land law;land use;landowners";"Land, Climate Change & Environment";"001";"Journal Articles & Books";"http://dspace.uasm.md/handle/123456789/2995";"http://dspace.uasm.md/rest/bitstreams/25e0f328-6d28-44de-83b3-7bef7802c9bb/retrieve";;;;;;"uasm:2995"
"uasm:3565";"Asigurarea informațională a dezvoltării sustenabile";;"The paper analyzes the provision with spatial information and the mode of its use in rural municipalities. The purpose of this study is to examine the ensurance with spatial information about natural capital within the ATU. The study examines the content and issues faced by local authorities while collecting and managing spatial information . There are given some proposals on the development of the Information System of the locality.";"Potînga, Octavian
Turculeț, Mihail
Popescul, Sergiu";;;"Republican Scientific Agricultural Library of the State Agrarian University of Moldova";"2016-12-31";"ro";"cadastres;land administration;natural resources;rural areas;sustainable development";"Land Stakeholders & Institutions;Land, Climate Change & Environment;Socio-Economic & Institutional Context";"001";"Journal Articles & Books";"http://dspace.uasm.md/handle/123456789/3565";"http://dspace.uasm.md/rest/bitstreams/236674d9-c15b-4597-8d49-0122f020cb1b/retrieve";;;;;;"uasm:3565"
"uasm:4409";"Sistemul informaţional al cadastrului agricol în Republica Moldova";;"Condiţiile climaterice instabile caracteristice pentru Republica Moldova destabilizează piaţa produselor agricole. Acestea, dar şi alte particularităţi ale agriculturii contemporane, pun societatea noastră în faţa unei nevoi acute de informatizare, mai ales înceea ce-i priveşte pe producătorii agricoli(fermierii), dar şi autorităţile publice de toate nivelurile. Implementarea Sistemului Informaţional al cadastrului agricol, iniţiată cu succes în ţara noastră, este o soluţie fundamentală în acest sens. În articol este prezentată structura Sistemului Informaţional al cadastrului agricol şi sunt analizaţi factorii care impulsionează elaborarea şi implementarea acestui sistem: necesitatea securităţii alimentare; necesitatea implementării metodelor moderne de administrare a terenurilor agricole, inclusiv subvenţionarea agriculturii; necesitatea cunoaşterii temeinice a obiectului Sistemului Informaţional al cadastrului agricol şi anume calităţile fondului funciar agricol etc. În procesul de dezvoltare şi de integrare europeană, agricultura Republicii Moldova se va confrunta inevitabil cu necesitatea implementării unui Sistem Informaţional al cadastrului agricol, după modelul ţărilor partenere. Cunoaşterea mediului informaţional, argumentarea ştiinţifică a procesului de informatizare a societăţii, a domeniuluirural şi nu numai, devin obiective majore. 

Unstable weather conditions specific for the Republic of Moldova destabilize the agricultural products market. These and other features of modern agriculture make our society to face acute need for informatization, especiallyitconcernsthe agricultural producers(farmers) but also public authorities of all levels.The implementation ofAgricultural Cadastre InformationSystem, initiated successfullyin our country, is a fundamental solutionin this regard. This paper presents the structure of Agricultural Cadastre Information System and analyzes the factors impelling the development and implementation of this system: the need for food security, the need to implement modern methods of agricultural land management, including agricultural subsidies; the need to have a thorough knowledge ofthe object ofthe Agricultural Cadastre Information System and namelythe qualityof agricultural land fund etc. In the process of European integration and development, Moldovan agriculture will inevitably face the need toimplement anAgricultural Cadastre Information System accordingto the model of partner countries.Among its major objectives we can mention the knowledge of information environment and scientific argumentation of information process for the society, especially for rural areas and beyond.";"Popescul, Sergiu
Botnarenco, Ion";;;"Republican Scientific Agricultural Library of the State Agrarian University of Moldova";"2013-12-31";"ro";"agriculture;cadastres;farmland;land management";"Land Stakeholders & Institutions";"MDA";"Journal Articles & Books";"http://dspace.uasm.md/handle/123456789/4409";"http://dspace.uasm.md/rest/bitstreams/41dbf052-16ce-4f40-b69e-e2d2e4e547cc/retrieve";;;;;;"uasm:4409"
"uasm:4943";"Utilizarea fondului funciar la realizarea strategiilor de mediu în bazinul hidrografic Nistru";;"Sunt examinate posibilităţile de colectare a datelor în cadrul UTA necesare pentru realizarea măsurilor de gestionare a districtului Bazinului Hidrografic Nistru. Lucrarea are ca scop cunoaşterea arealului geografice, a tipurilor, formelor de relief, expoziţiei şi lungimii versanţilor, modul de utilizare a terenului din spaţiul studiat.";"Corman, Iulia
Turculeț, Mihail
Popescul, Sergiu";;;"Republican Scientific Agricultural Library of the State Agrarian University of Moldova";"2017-12-31";"ro";"land management;land use";"Land Stakeholders & Institutions;Land, Climate Change & Environment";"MDA";"Journal Articles & Books";"http://dspace.uasm.md/handle/123456789/4943";"http://dspace.uasm.md/rest/bitstreams/ed33e840-27fd-49c1-b32c-eebb789832d0/retrieve";;;;;;"uasm:4943"
