LaReferencia:AR_c40a98f99ea7c3bec350b8d13d32aa61;Climate downscaling over South America for present- day climate (1970-1989) using the MM5 Model. Mean, Interannual Variability and Internal Variability;;"Este trabajo evalúa la capacidad del modelo regional MM5 para representar las principales características del clima actual de Sudamérica. Se evalúa la distribución espacial de los valores medios estacionales, la variabilidad interanual y el ciclo anual de la precipitación y la temperatura, así como la variabilidad interna. El análisis tuvo dos objetivos: cuantificar la capacidad de la regionalización (downscaling) dinámica para representar el clima actual e identificar los aspectos críticos de la simulación climática regional en Sudamérica para interpretar las proyecciones hacia fines de siglo XXI en el escenario de emisión SRES A2 con cierto grado de confiabilidad. En general, el modelo MM5 representa de forma adecuada las características regionales, el ciclo estacional y la variabilidad interanual de las variables de superficie en el sur de Sudamérica. La distribución espacial de la temperatura está bien representada; sin embargo, se encuentran algunos errores sistemáticos, como una sobreestimación en el centro y norte de Argentina y una subestimación en las regiones montañosas a lo largo del año. La distribución espacial de la precipitación también está bien representada por el modelo regional, sin embargo se encuentra una sobreestimación de la precipitación en la región andina (especialmente en el centro y sur de Chile) en todas las épocas del año y una subestimación de la precipitación en latitudes tropicales. El ciclo anual de la precipitación está representado de manera adecuada en todas las regiones analizadas, sin embargo su representación es mejor en la cuenca del Plata (LPB, por sus siglas en inglés), Cuyo (CU) y sur de Buenos Aires (región denominada sureste Pampas [SEP]). El ciclo anual de la temperatura media también está bien representado. En líneas generales, el modelo sobreestima la variabilidad interanual de la temperatura y subestima la variabilidad interanual de la precipitación. De la evaluación de la variabilidad interanual, la variabilidad interna y los sesgos, puede concluirse que independientemente de la época del año, la precipitación simulada por el modelo regional MM5 es confiable en latitudes subtropicales, Uruguay, el sur de Brasil y el centro-este de Argentina, pero es poco confiable en áreas montañosas. La temperatura es confiable en latitudes subtropicales, Uruguay y el sur de Brasil solamente durante el invierno, pero es poco confiable o se encuentra en el límite de confiabilidad en el centro y sur de Chile a lo largo del año. De esta manera, puede concluirse que el modelo MM5 es una herramienta de mucha utilidad para la generación de escenarios regionales de cambio climático de alta resolución en el sur de Sudamérica y constituye un interesante punto de partida para evaluar los escenarios regionales de cambio climático en dicha región.";"Cabre, Maria Fernanda

Solman, Silvina Alicia

Nuñez, Mario Nestor";;Universidad Autónoma de México. Centro Ciencias de la Atmósfera;LA Referencia;26/02/2016;en;"environment; climate change; land use; land policies; natural resources management;";Land, Climate change & Environment;"Land Policy & Legislation;Land Use, Management & Investment";"BRA;CHL;URY;005;ARG";Journal Articles & Books;http://www.lareferencia.info/vufind/Record/AR_c40a98f99ea7c3bec350b8d13d32aa61;http://hdl.handle.net/11336/4465;;CC-BY-NC-ND;info:eu-repo/semantics/openAccess : Open Access, this refers to access without restrictions, and without financial incentives. Access to the resource is gained directly, without any obstacles.;
LaReferencia:AR_1877b032933b97155306ef7002707fe6;El debate sobre desplazamientos poblacionales por deterioro ambiental : Indagaciones sobre su aplicación al caso de Argentina;;La conceptualización de las personas desplazadas por el deterioro ambiental ha sido –y continúa siendo treinta años después de sus orígenes- tema de debate entre especialistas de diversas disciplinas. En el contexto latinoamericano esta problemática se encuentra estrechamente vinculada con el modelo de inserción internacional implementado por los países de la región. La profundización de un modelo basado en la exportación de productos primarios conlleva una agudización de problemas ambientales preexistentes. Dinámica que aumenta la presión sobre sectores de la sociedad vulnerables tanto a los impactos ambientales como a la falta de empleo.;Estrada, Victoria de;;;LA Referencia;01/06/2010;es;"environment; displacement; land rights; land policies;";"Land Conflicts;Land, Climate change & Environment";"Land Policy & Legislation;Access to Land & Tenure Security";ARG;Journal Articles & Books;http://www.lareferencia.info/vufind/Record/AR_1877b032933b97155306ef7002707fe6;http://sedici.unlp.edu.ar/handle/10915/37565;;CC-BY;info:eu-repo/semantics/openAccess : Open Access, this refers to access without restrictions, and without financial incentives. Access to the resource is gained directly, without any obstacles.;
LaReferencia:AR_b0461dfac69604568c2ead574fb8f171;Espacios verdes urbanos, fortalezas, amenazas y oportunidades de mejora;;En términos de sustentabilidad es preciso entender, diseñar y manejar el verde urbano adecuadamente desde una perspectiva ecológica, estética y recreativa (FTL-HSR & ZSA 2006). Se presentan aquí a modo de ejemplos resultados de investigaciones realizadas en Buenos Aires, Salzburgo y Munich, que aportan ideas sobre el valor de los espacios verdes y de las problemáticas a los cuales se enfrentan.;"Breuste, Juergen

Artmann, A.

Wurster, D.

Voigt, Annette

Faggi, Ana Maria";;UFLO;LA Referencia;22/02/2016;es;"land development (urbanization); urban areas; urban forestry;";"Urban Tenure;Forest Tenure";Land Use, Management & Investment;ARG;Journal Articles & Books;http://www.lareferencia.info/vufind/Record/AR_b0461dfac69604568c2ead574fb8f171;http://hdl.handle.net/11336/4353;;CC-BY-NC-ND;info:eu-repo/semantics/openAccess : Open Access, this refers to access without restrictions, and without financial incentives. Access to the resource is gained directly, without any obstacles.;
LaReferencia:PE_875d37e15050ccd3dfa0f4c7a9e15357;Nivel de conocimiento sobre manejo forestal sostenible del poblador de la provincia de Atalaya que participó del programa de capacitación del OSINFOR, 2017;;La presente investigación tuvo como objetivo fundamental determinar el nivel de conocimientos sobre manejo forestal sostenible que presenta el poblador de la Provincia de Atalaya – Departamento de Ucayali, que recibió capacitación del OSINFOR, aplicando la evaluación en el año 2017. La investigación se desarrolló bajo el enfoque cuantitativo y fue sustantiva de nivel descriptivo, por lo que se aplicó un diseño no experimental de corte transversal. La población de estudio estuvo constituida por los pobladores de la Provincia de Atalaya – Departamento de Ucayali, que recibieron capacitación del OSINFOR y accedieron a participar en el estudio. Al respecto es importante precisar el rol que cumple el OSINFOR que se encarga de supervisar y fiscalizar el aprovechamiento sostenible y la conservación de los recursos forestales y de fauna silvestre, así como brindar labores de formación y capacitación a diversos actores involucrados en el aprovechamiento de los recursos forestales y de fauna silvestre. Considerando que la aportación humana es indispensable para el manejo forestal sostenible. Los resultados de la investigación evidenciaron que los pobladores de la Provincia de Atalaya que recibieron capacitación del OSINFOR presentaron un nivel de conocimientos de 37% nivel bajo, 35% nivel alto y 28% nivel medio, con lo que debe fortalecerse a estos pobladores, conocer más de manejo forestal, asimismo medido según sexo se obtuvo que las mujeres tuvieron la calificación de 74% nivel bajo, 21% nivel medio y 5% nivel alto) y masculinos (46% nivel alto, 30% nivel medio y 25% nivel bajo) es decir los varones tuvieron mejores calificaciones en conocimiento del manejo forestal sostenible. Finalmente, se concluyó que se adquirió un nivel de conocimiento bajo los pobladores de Atalaya y respecto a las comparaciones entre las comunidades que tuvieron mayores conocimientos La Unión San Francisco obtuvo mayor calificación con 39% nivel alto, respecto al sexo los varones tuvieron mayor calificación con 46% nivel alto y según nivel de estudios los de nivel secundaria tuvieron mayor calificación con 54% alto, y según rango de edad los que tuvieron alta calificación fueron los de 18 años a 28 con 39% nivel alto y de 39 a más años de edad obtuvo 39% de nivel alto de conocimiento en manejo forestal aprendido del programa de capacitación OSINFOR, 2017 en las comunidades de la Provincia de Atalaya, por ello se debería ampliar los talleres de manejo forestal.;Pajuelo Pérez, Daisy Maria;;Universidad César Vallejo;LA Referencia;31/10/2017;es;"natural resources management; forest management plans; forest land; land use; agroforestry systems;";Forest Tenure;Land Use, Management & Investment;PER;Reports & Research;http://www.lareferencia.info/vufind/Record/PE_875d37e15050ccd3dfa0f4c7a9e15357;http://repositorio.ucv.edu.pe/handle/UCV/15379;;CC-BY;info:eu-repo/semantics/openAccess : Open Access, this refers to access without restrictions, and without financial incentives. Access to the resource is gained directly, without any obstacles.;
LaReferencia:CO_c3660c598b78a9f5ffa9fc3d76888fce;La migración generada por actividades de inversión extranjera en Colombia: Repensando los esquemas de protección y responsabilidad;;"Este artículo tiene como finalidad explorar la relación que existe entre las dinámicas de la inversión extranjera y la migración formada en el contexto del conflicto armado colombiano. Mediante la presentación de una serie de casos recientes, se muestran las diversas formas en que la operación de las empresas multinacionales ha generado efectos negativos a las comunidades vulnerables ubicadas en las zonas de influencia de esos proyectos, lo que implica procesos de movilidad humana involuntaria. En esa medida, se establece que hay una relación simbiótica entre el conflicto armado y el desarrollo, lo cual redunda en la estructura de las normas de protección de migrantes y responsabilidad por violación de derechos humanos, que suelen desconocer este tipo de casos; esto se debe a que el interés económico es visto como un factor de progreso general, que constriñe su reconocimiento como un interés jurídico válido.";Velásquez Ruiz, Marco Alberto;;Pontificia Universidad Javeriana;LA Referencia;15/05/2013;en;"land use; land conflicts; land concentration; displacement; rural population;";Land Conflicts;"Land Use, Management & Investment;Access to Land & Tenure Security";COL;Journal Articles & Books;http://www.lareferencia.info/vufind/Record/CO_c3660c598b78a9f5ffa9fc3d76888fce;http://revistas.javeriana.edu.co/index.php/internationallaw/article/view/13655;;CC-BY;Copyright (c) 2016 Marco Alberto Velásquez Ruiz;
LaReferencia:CO_19186085355b0aa51dd4c3758e71505f;El referendo constitucional para que el acceso al agua sea un derecho;;El objeto de esta ponencia es analizar los aspectos socioeconómicos y jurídicos que sustentan la reforma de la Constitución por vía de referendo, que pretende prescribir el derecho fundamental al agua, e indicar que las disposiciones propuestas a la ciudadanía son acertadas para resolver sus necesidades más sentidas en esta materia. La tesis central del texto es que el orden constitucional colombiano requiere una reforma de esta naturaleza porque debe honrar los compromisos adquiridos internacionalmente, pues Colombia ha ratificado el Pacto Internacional de Derechos Sociales, Económicos y Culturales y otros tratados internacionales que disponen obligaciones sobre el derecho al agua de las cuales son titulares los ciudadanos colombianos.;Suárez, Federico;;Departamento de Derecho Constitucional;LA Referencia;13/06/2010;es;"land rights; water rights; land policies; land governance;";;"Land Policy & Legislation;Access to Land & Tenure Security";COL;Journal Articles & Books;http://www.lareferencia.info/vufind/Record/CO_19186085355b0aa51dd4c3758e71505f;http://revistas.uexternado.edu.co/index.php/derest/article/view/443;;CC-BY-NC-SA;Copyright (c) 2010 Federico Suárez;
LaReferencia:MX_6a91cf7e7da4eca487e21e8e9ae0f36a;Acciones y estrategias para un plan de manejo de la microcuenca de Monte Caldera, San Luis Potosí;;El objetivo principal de este trabajo fue identificar las condiciones socioecono?micas y aprovechamiento de los recursos naturales de la microcuenca de Monte Caldera, para diagnosticar sus problemas y proponer acciones y estrategias que contribuyen a elaborar un futuro plan de manejo, procurando la conservacio?n de las funciones sustantivas de la microcuenca. El a?rea de estudio se localiza aproximadamente a 20 km al este de la ciudad de San Luis Potosi?, abarca las localidades de Monte Caldera y de Jesu?s Mari?a pertenecientes al Municipio de Cerro de San Pedro y a la comunidad San Antonio de Egui?a que pertenece al Municipio Armadillo de los Infantes. La actividad metalu?rgica histo?rica que se desarrollo? en este sitio provoco? la contaminacio?n del suelo por plomo y otros metales los que provocaron a su vez la contaminacio?n de aguas superficiales y de sedimentos de escorrenti?a. Adema?s, debido a que se utilizaba carbo?n en grandes cantidades por la elevada demanda energe?tica del proceso, existe una severa deforestacio?n del sitio, lo que ocasiono los actuales procesos de erosio?n hi?drica de suelos a lo largo de la microcuenca. Los problemas de pe?rdida de suelos y de los impactos ocasionados por la mineri?a histo?rica son considerados en la caracterizacio?n. Los resultados del ana?lisis estadi?stico y FODA basados en la informacio?n recopilada referente a los aspectos ambientales, sociales y econo?micos, junto con la actualizacio?n de la carta de uso de suelo y vegetacio?n se utilizaron para la construccio?n de escenarios con los cuales se elaboraron las estrategias y acciones para un futuro plan de manejo de la microcuenca.;Jiménez Lira, Marisela;;Universidad Autónoma de San Luis Potosí;LA Referencia;01/08/2012;es;"natural resources management; water management; land use planning; rural development;";;Land Use, Management & Investment;MEX;Reports & Research;http://www.lareferencia.info/vufind/Record/MX_6a91cf7e7da4eca487e21e8e9ae0f36a;http://www.remeri.org.mx/portal/REMERI.jsp?id=oai:ninive.uaslp.mx:i/3686;;;info:eu-repo/semantics/openAccess : Open Access, this refers to access without restrictions, and without financial incentives. Access to the resource is gained directly, without any obstacles.;
LaReferencia:BR_0c9d59891e1f0f08be9863f4e780ccf8;Desplazamiento forzado y periferias urbanas: la lucha por el derecho a la vida en Medellín;;O deslocamento forçado pela violência na Colômbia é um processo histórico de expropriação e violação sistemática dos direitos humanos, que impacta os processos vitais ao nível individual e social gerando um profundo dano na qualidade de vida das pessoas vítimas deste crime. O abandono obrigado dos lugares de moradia habitual é experimentado pelas populações para evitar as consequências mortais da guerra ou de outras situações que envolvem o uso da força para desocupar o campo. As cidades são os principias locais de destino dos desterrados e, a periferia urbana é o espaço onde cada uma destas pessoas se inserem para reconstruir a sua vida. No enquadramento do doutorado em Saúde Pública da Escola Nacional de Saúde Pública da Fundação Oswaldo Cruz se realizou a presente investigação focalizada nas experiências dos moradores de Altos de la Torre, Pacífico e Nuevo Amanecer (Mano de Dios), lugares de assentamento de população em situação de deslocamento forçado em Medellín. O objetivo desta pesquisa foi descrever e analisar os processos organizativos da população deslocada e as relações construídas com outros atores sociais em estes territórios. Além disso, procurou-se identificar a suas ações coletivas em esta cidade. Para isso, realizou-se um estudo etnográfico no período compreendido entre fevereiro de 2008 e março de 2009. A partir dos resultados e as conclusões pode-se identificar o deslocamento forçado como um processo dialético, que expõe uma clara contradição entre as situações de desarraigamento e ruptura geradas a partir do desterro e, a produção e reprodução social da vida no contexto urbano. Deste modo, desencadeiam-se processos coletivos, no meio das construções possíveis, bem como das disputas de poder, conflitos e violências que determinam em grande medida estas experiências. Também é importante ressaltar que apesar de ser o Estado colombiano o responsável pela atenção à população deslocada, a suas respostas limitam o direito à reparação integral e aprofundam as condições de miséria e exclusão. Em este contexto, os desterrados desenvolvem iniciativas de organização e participação para tentar satisfazer necessidades básicas e exigirem seus direitos. A sua capacidade de ação se vê limitada por vários fatores, entre eles o empobrecimento radical, as desconfianças, a burocracia institucional, o assistencialismo, e, os múltiplos conflitos e violências.;Gómez Builes, Gloria Marcela;;;LA Referencia;31/10/2010;es;"displacement; land conflicts; urban areas;";Land Conflicts;Access to Land & Tenure Security;COL;Reports & Research;http://www.lareferencia.info/vufind/Record/BR_0c9d59891e1f0f08be9863f4e780ccf8;http://www.arca.fiocruz.br/bitstream/icict/2580/1/ENSP_Tese_Gomes_Builes_Gloria_Marcela.pdf;;;info:eu-repo/semantics/openAccess : Open Access, this refers to access without restrictions, and without financial incentives. Access to the resource is gained directly, without any obstacles.;
LaReferencia:BR_d00c5cd155b9b2f0bc4d5d8fb5447d09;Monsieur le Capital e Madame la Terre: dos fundamentos teóricos às significações da reforma agrária;;GASTELO ACUÑA, Raul Patrício. Monsieur le Capital e Madame la Terre: dos fundamentos teóricos às significações da reforma agrária. 2009. 224f. – Tese (Doutorado) – Universidade Federal do Ceará, Programa de Pós-graduação em Sociologia, Fortaleza (CE), 2009.;GASTELO ACUÑA, Raul Patrício;;www.teses.ufc.br;LA Referencia;31/10/2009;pt;"land rights; land tenure; land investments; agrarian reform;";Land & Investments;"Land Policy & Legislation;Land Use, Management & Investment;Access to Land & Tenure Security";419;Reports & Research;http://www.lareferencia.info/vufind/Record/BR_d00c5cd155b9b2f0bc4d5d8fb5447d09;http://www.repositorio.ufc.br/bitstream/riufc/6250/1/2009-TESE-RPGACUNA.pdf;;;info:eu-repo/semantics/openAccess : Open Access, this refers to access without restrictions, and without financial incentives. Access to the resource is gained directly, without any obstacles.;
LaReferencia:BR_11e00d29db5b1711cd32046f949eebd7;"Uso de ""ecotécnicas"" no manejo de águas pluviais em meio urbano: uma abordagem crítica";;The environmental situation of the cities, especially the larger ones, presents serious problems arising from human's inability to meet the demands of the agglomerations as they are settled, generating environments with low conditions of habitability. The supremacy of economic interests on natural ecosystems has established a complex network of impacts in raising resources to build the cities, from the extraction of material to the issuance of its final waste. In the last decades, several issues have been presented, many of them referring to urban systems, however, in spite of all the discussion related to preservation and restoration of ecosystems, there are still few transformations to be seen in the cities. This work aims to identify possible confrontations for this panorama, facing both the needs to meet demands for urban infrastructure and to preserve the environment by broadening the debate about implementation of solutions that comply characteristics and cycles of the territory, as well as increasing environmental quality to conviviality. Emphasis was given to the systems of rainwater management, since its inadequacies or shortcomings have been causing crescent collapses, with catastrophic consequences and severe damage to the affected populations. From reviewing some specific literature to this theme, such as Natural Engineering and Bioengineering of Soils, the concept of Urban Ecotechnique was defined, in which 8 variables have been outlined to analyze the application of 28 building techniques related to rainwater management systems, in order to evaluate the degree of service in qualitative sense. Finally, it has been done a discussion of the results from the interpolation of the information collected in an array, where the 28 techniques were crossed with the 8 variables, in an attempt to synthesize and better illustrate the result of the research process. It was noted that, in addition to the different degrees of service and readings generated, the association in chain of Ecotechniques and the cultural transformation of society can be guiding parameters of new attitudes to overcome the current situation. It was then concluded that the employment of Ecotechniques has been shown as a viable way of allying the resolution of urban environmental issues to the promotion of a cultural transformation that integrates people to the built environment, in a complete and natural way.;Silva, Eduardo Araujo;;Universidade Federal de São Carlos;LA Referencia;31/10/2010;pt;"water management; urban areas; land development (urbanization);";Urban Tenure;Land Use, Management & Investment;BRA;Reports & Research;http://www.lareferencia.info/vufind/Record/BR_11e00d29db5b1711cd32046f949eebd7;https://repositorio.ufscar.br/bitstream/ufscar/4346/1/5057.pdf;;;info:eu-repo/semantics/openAccess : Open Access, this refers to access without restrictions, and without financial incentives. Access to the resource is gained directly, without any obstacles.;
LaReferencia:AR_25e156f4fa05eeb3947274d4464e0d8b;Servicios ecosistémicos y deforestación en la Selva Paranaense : Análisis comparativo en la Cuenca Binacional del río San Antonio (Argentina-Brasil) entre 2001 y 2011;;"Por sus condiciones biofísicas, los bosques tropicales poseen gran capacidad para ofrecer servicios ecosistémicos. La Selva Paranaense, uno de los bosques tropicales lluviosos más amenazados de Sudamérica, alcanza actualmente 1.200.000 ha, conservadas fundamentalmente en Argentina y en menor medida en Brasil y Paraguay. Este trabajo propone analizar la pérdida de servicios de regulación a partir de la evaluación del proceso de deforestación y cambio de uso del suelo entre 2001 y 2011 en una cuenca binacional argentino-brasileña, la Cuenca del río San Antonio CrSA). La superficie de dicha cuenca (117.348 ha), que forma parte del río Iguazú, se distribuye de manera semejante en ambos países. Sin embargo, la clasificación de las imágenes satelitales (Landsat 5, sensor TM) revela que Argentina conserva en 2011 el 61,7% de áreas boscosas en las que predominan servicios de regulación, mientras que Brasil el 25%. No obstante, la tasa de deforestación total anual promedio (R) y la tasa de cambio anual (q) en el período, fueron significativamente más altas en el sector argentino (R: 8,143; q: 0,02) que en el brasileño (R: 1,493; q: 0,01). Los datos de temperatura proporcionados por el satélite (banda 6), indican una relación directa entre las temperaturas más bajas y lasuperficie boscosa, que coincide con la clasificación realizada. Se considera fundamental profundizar en el análisis de los vínculos existentes entre la capacidad de provisión de servicios ecosistémicos y las demandas sociales, así como en el desarrollo de metodologías para la valoración de servicios en áreas de frontera.";"Zulaica, Maria Laura

Vazquez, Patricia Susana

Celemin, Juan Pablo";;Universidade Federal do Paraná;LA Referencia;28/12/2016;es;"environment; natural resources management; forest land; forest management plans; deforestation;";"Land, Climate change & Environment;Forest Tenure";Land Use, Management & Investment;"PRY;005;BRA;ARG";Journal Articles & Books;http://www.lareferencia.info/vufind/Record/AR_25e156f4fa05eeb3947274d4464e0d8b;http://hdl.handle.net/11336/10535;;CC-BY-NC-SA;info:eu-repo/semantics/openAccess : Open Access, this refers to access without restrictions, and without financial incentives. Access to the resource is gained directly, without any obstacles.;
