LaReferencia:CO_9cb4943eeec14a535a8c20f0de6d459f;Derechos humanos, producción y reproducción de la pobreza: incidencia del Tratado de Libre Comercio Canadá - Colombia;;El siguiente artículo argumenta cómo el Tratado de Libre Comercio (TLC) entre Canadá y Colombia, iniciado el 21 de noviembre de 2008, aumentará las condiciones de vulnerabilidad de la población dedicada al corte de caña de azúcar en el departamento del Valle del Cauca, Colombia. En este sentido, el poder de los organismos internacionales y el de las empresas multinacionales contribuirán a la violación de los Derechos Humanos manteniendo un orden global injusto que ahonda las condiciones de pobreza de las personas que ejercen estas actividades;Guevara Fletcher, Diego Andrés;;Universidad Militar Nueva Granada;LA Referencia;31/10/2010;es;"poverty; agriculture; rural population; rural areas; food security;";Land & Food Security;Land Use, Management & Investment;"COL;CAN";Journal Articles & Books;http://www.lareferencia.info/vufind/Record/CO_9cb4943eeec14a535a8c20f0de6d459f;http://hdl.handle.net/10654/8334;;;info:eu-repo/semantics/openAccess : Open Access, this refers to access without restrictions, and without financial incentives. Access to the resource is gained directly, without any obstacles.;
LaReferencia:MX_2b6ade1485e3f695fa1d5f30a528ec89;Áreas prioritarias mediante escenarios de deforestación y servicios ambientales en la Sierra Norte de Puebla.;;"La identificación de áreas prioritarias es una herramienta valiosa que permite orientar y optimizar los esfuerzos de estudio, conservación y aprovechamiento sustentable de recursos forestales. La presente investigación integró una metodología, mediante la combinación de diferentes técnicas cuantitativas en un ambiente de sistemas de información geográfica y sensores remotos, para la identificación de áreas prioritarias de recarga hídrica en la Unidad de Manejo Forestal Zacatlán, Puebla. El estudio se constituyó de tres componentes de investigación: (1) Análisis retrospectivo (1986-2010), actual y perspectivo (2010-2030) de cambios de uso de la tierra y riesgo de deforestación; (2) Identificación de áreas con aptitud para proveer servicios ambientales hidrológicos (recarga hídrica subterránea); y (3) Identificación de áreas prioritarias sujetas a ser conservadas, por su potencial para brindar servicios ambientales hidrológicos y su riesgo futuro de deforestación. Los resultados indican que de la superficie total de la región de estudio (269,002 ha), el 53.02% (142,636.41 ha) corresponden a uso forestal y de ésta, el 21.84% (31,152 ha) poseen riesgo de deforestación al año 2030. Por otro lado, la aptitud para la recarga hídrica subterránea se distribuye en 21,315.35 ha con aptitud alta, 169,995.01 ha con aptitud media y 75,100.09 ha con aptitud baja. Finalmente, mediante la combinación de riesgo de deforestación y aptitud de recarga hídrica subterránea, se obtuvieron 5,727 ha con prioridad alta, 9,981 ha con prioridad media y 13,313 ha con prioridad baja para la conservación del servicio ambiental hidrológico considerado. Los resultados permitieron la generación de estrategias de manejo y conservación de ecosistemas forestales, concluyendo que las áreas prioritarias deben ser la base para la implementación de políticas públicas para la conservación de los recursos forestales de la región de estudio. _______________ PRIORITY AREAS THROUGH DEFORESTATION SCENARIOS AND ENVIRONMENTAL SERVICES IN THE NORTHERN SIERRA OF PUEBLA. ABSTRACT: The identification of priority areas is a valuable tool to guide and optimize the efforts of study, conservation and sustainable use of forest resources. This research integrated a methodology by combining different quantitative techniques in an environment of GIS and remote sensing for identify priority areas for water recharge in the Unidad de Manejo Forestal Zacatlán, Puebla. The study was integrated by three components: (1) Retrospective Analysis (1986-2010), current and prospective (2010-2030) land use change and deforestation risk, (2) Identification of areas with capacity for provide hydrological services (ground water recharge), and (3) Identification of priority areas subject to conservation, based on its potential to provide hydrological services and their future risk of deforestation. The results indicate that of the total area of the region under study (269,002 ha), 53.02% (142,636.41 ha) corresponds to forest and 21.84% (31,152 ha) have risk of deforestation by 2030. On the other hand, the suitability for ground water recharge is distributed in 21,315.35 ha, 169,995.01 ha, and 75,100.09 ha with high, medium an low recharge capacity, respectively. Finally, by combining deforestation risk and suitability of ground water recharge 5,727 ha were obtained with high, 9,981 ha with medium, and 13,313 ha with low priority for the conservation of the hydrological ecosystem service considered. The results allowed the generation of strategies for management and conservation of forest ecosystems. Finally, the determination of priority areas should be the basis to implement public policies for the conservation of forest resources in the region of study.";Chávez González, Honoria;;Colegio de Postgraduados;LA Referencia;21/04/2014;es;"forest land; deforestation; land use; land policies; forest management plans;";"Land, Climate change & Environment;Forest Tenure";"Land Policy & Legislation;Land Use, Management & Investment";MEX;Reports & Research;http://www.lareferencia.info/vufind/Record/MX_2b6ade1485e3f695fa1d5f30a528ec89;http://www.remeri.org.mx/portal/REMERI.jsp?id=oai:www.biblio.colpos.mx:10521/2248;;;info:eu-repo/semantics/openAccess : Open Access, this refers to access without restrictions, and without financial incentives. Access to the resource is gained directly, without any obstacles.;
LaReferencia:CO_73931270a9e3584b81402f838eedcc45;Relationship between the Processes of Urbanization and International Trade, and its Impact on Urban Sustainability;;The dynamics of urbanization and growth of the Latin American city is due to different geographical, economic, and social factors. One of these elements, which has expanded the availability of resources for the urban expansion process is the growth of international trade, whereas it facilitates the import and availability of goods from anywhere in the world and consolidates cities as large markets, making them more attractive each time, which falls again in the process of growth. Based on the approach to urban sustainability and from the literature review and consultation of international organizations, this article presents some relationships between the growth in international trade and its impact on the increase in the consumption of goods and urban expansion process. In the discussion of results, it is stated that the greater availability of goods and services (flows of matter and energy) accelerate the process of metabolism of cities and adversely affect environmental quality by emissions and waste.;"Carreño Campo, Carolina; Consejo Noruego para Refugiados (NRC)

Alfonso P, William H.; Universidad del Rosario";;Pontificia Universidad Javeriana;LA Referencia;11/05/2018;pt;"urbanization; urban areas; urban planning; development;";Urban Tenure;Land Use, Management & Investment;COL;Journal Articles & Books;http://www.lareferencia.info/vufind/Record/CO_73931270a9e3584b81402f838eedcc45;http://revistas.javeriana.edu.co/index.php/cvyu/article/view/22109;;CC-BY;Copyright (c) 2018 Carolina Carreño Campo;
LaReferencia:CL_276092b960133f9f7fa56ac4029e4fd4;LA TUTELA DEL ACCESO AL AGUA POTABLE EN EL DERECHO INTERNACIONAL;;"En atención a los problemas de contaminación y al estrés hídrico que se dan actualmente (y que repercuten en la salud y en las condiciones de vida de las personas) se considera relevante analizar el tema del acceso al agua potable a la luz del Derecho Internacional Público, con el fin de identificar las bases jurídicas para la tutela de las demandas de agua para el consumo humano. En particular, se analizarán los principales convenios internacionales sobre derechos humanos y gestión de los recursos hídricos, los documentos no vinculantes (""soft law"") que se refieren al acceso al agua potable y la jurisprudencia internacional, en particular modo la de la Corte Interamericana de Derechos Humanos y del Tribunal Europeo de Derechos Humanos. A través de este trabajo se quiere demonstrar que en el Derecho internacional existen normas que protegen la satisfacción de las demandas humanas de agua potable y otras que incluso reconocen el acceso al agua potable como un derecho humano.";BERTAZZO,SILVIA;;Universidad Católica del Norte;LA Referencia;01/01/2015;es;"natural resources management; water rights; land policies; sustainable development;";Socio-Economic & Institutional Context;"Land Policy & Legislation;Land Use, Management & Investment;Access to Land & Tenure Security";GLOBAL;Journal Articles & Books;http://www.lareferencia.info/vufind/Record/CL_276092b960133f9f7fa56ac4029e4fd4;https://scielo.conicyt.cl/scielo.php?script=sci_arttext&pid=S0718-97532015000200003;;;info:eu-repo/semantics/openAccess : Open Access, this refers to access without restrictions, and without financial incentives. Access to the resource is gained directly, without any obstacles.;
LaReferencia:CR_a808369670baa7eafbb467a6e43ab672;Luchas costeñas por los derechos territoriales y el control de los emergentes espacios mediáticos de Nicaragua;;Este artículo trata de las respuestas mediáticas a la crisis actual en la Costa Caribe de Nicaragua y los retrocesos a las luchas regionales por la autonomía y los derechos a la tierra. Proporciona un panorama detallado del actual conflicto en el Caribe Norte, en particular cómo las acciones violentas de los colonos ilegales están acelerando la inseguridad y la degradación ambiental y cómo organizaciones de derechos humanos como CEJUDCHAN están utilizando espacios como YouTube para responder a esta situación. También esboza las luchas por el pueblo Rama Kriol en el Caribe Sur en contra del canal interoceánico. A partir del concepto de sociología de ausencias de Boaventura de Sousa Santos, el trabajo explora la inacción, la indiferencia y el engaño del Gobierno, así como la producción, distribución y visibilidad de los medios de comunicación de base.;"Cupples, Julie

Glynn, Kevin";;Universidad de Costa Rica;LA Referencia;01/07/2018;es;"land rights; land conflicts; land policies; land administration;";Land Conflicts;"Land Policy & Legislation;Access to Land & Tenure Security";NIC;Journal Articles & Books;http://www.lareferencia.info/vufind/Record/CR_a808369670baa7eafbb467a6e43ab672;https://revistas.ucr.ac.cr/index.php/anuario/article/view/34125;;;Copyright (c) 2018 Julie Cupples, Kevin Glynn;
LaReferencia:CO_778c723a81f65b2600c69828e78e0c4a;La tragedia de los comunes en la competencia vertical entre jurisdicciones;;Los beneficios de la competencia institucional se alcanzan bajo ciertas normas que impiden la violación de derechos y la depredación de los recursos. La competencia horizontal puede tomar la forma de agresión violenta entre jurisdicciones (guerra) o la de cooperación y comercio. Su impacto puede ser “negativo” si substrae recursos de gobiernos benevolentes comprometidos con el bienestar general de la comunidad, pero “positivos” si se los considera como otra forma de controlar el Leviatán. La competencia vertical muestra los mismos controles “positivos” potenciales y la misma necesidad de ciertas reglas para cumplir ese papel. Son similares a la definición estricta del derecho de propiedad que resuelve la “tragedia de la propiedad común”. De otra forma puede crear una situación donde los contribuyentes son abusados por distintos niveles de autoridad fiscal como muestra el caso argentino.;Krause, Martín;;Universidad Sergio Arboleda;LA Referencia;31/10/2009;es;"land rights; rural population; land policies; land law;";;"Land Policy & Legislation;Access to Land & Tenure Security";ARG;Journal Articles & Books;http://www.lareferencia.info/vufind/Record/CO_778c723a81f65b2600c69828e78e0c4a;http://revistas.usergioarboleda.edu.co/index.php/ceye/article/view/55;;CC-BY-NC-ND;info:eu-repo/semantics/openAccess : Open Access, this refers to access without restrictions, and without financial incentives. Access to the resource is gained directly, without any obstacles.;
LaReferencia:AR_78bb58d7fc245e31ec46e9135d038185;La formación del mercado de tierras durante la expansión de la frontera bonaerense : Chascomús y Junín, 1860-1890;;En este trabajo nos proponemos analizar la formación del mercado de tierras durante la expansión de la frontera de la provincia de Buenos Aires entre 1860 y 1890, a partir de un enfoque local comparado, enfocando la investigación en dos partidos: Chascomús y Junín. Postulamos que la constitución del mercado de tierras en la campaña bonaerense fue un proceso gradual, que se inició apenas comenzaron a poblarse las tierras defendidas por los fuertes de la frontera interior y se establecían ciertas garantías de seguridad para la propiedad privada.;Banzato, Guillermo;;;LA Referencia;01/01/2009;es;"land; land use; land investments; land distribution; land concentration;";Land & Investments;Land Use, Management & Investment;ARG;Journal Articles & Books;http://www.lareferencia.info/vufind/Record/AR_78bb58d7fc245e31ec46e9135d038185;http://sedici.unlp.edu.ar/handle/10915/11703;;CC-BY;info:eu-repo/semantics/openAccess : Open Access, this refers to access without restrictions, and without financial incentives. Access to the resource is gained directly, without any obstacles.;
LaReferencia:CR_664abd78042280a93c3217182079e6c1;Urban spatial injustice in informal settlements;;The settlements of informal origin in Colombia emerged as an alternative to access housing for the socially and economically vulnerable population due to the limited institutional opportunities to obtain a solution. Thus, the victims of the armed conflict have found in this modality of urbanization a refuge in the city as a result of the forced displacement and the poverty. However, the different access modalities to the land relate this type of settlements with an illegal city due to the processes of irregular urbanization and self-production of housing developed far from the fulfillment of the urban norm. This denomination leads to an invisibilization of a set of injustices that the families who live there face off permanently. Given this scenario, the concept of space justice, which  was proposed in the seventies, was adopted with the intellectual movement called Radical Geography, so it could be explored new approaches to settlements of informal origin that allowed to overcome the confused idea of understanding the legal as an action of justice. The exploration is carried out from the revision of the set of political actions derived from those aws designed to guarantee the access to housing to the victims of the forced displacement because of the internal armed conflict in Colombia, and the reality observed through life stories. Finally, it is observed that the design of public policies continues to be thought from a utilitarian perspective, and for this reason the actions of justice are still measured in economic terms and not in social terms.;Rincón Castellanos, Milena;;Universidad de Costa Rica;LA Referencia;30/06/2018;es;"urban areas; informal settlements; urban planning; land policies;";Urban Tenure;"Land Policy & Legislation;Land Use, Management & Investment;Access to Land & Tenure Security";COL;Journal Articles & Books;http://www.lareferencia.info/vufind/Record/CR_664abd78042280a93c3217182079e6c1;https://revistas.ucr.ac.cr/index.php/revistarquis/article/view/33836;;CC-BY-NC-ND;Copyright (c) 2018 Milena Rincón Castellanos;
LaReferencia:PE_7432ffa93863256da6c710b6687526fb;Esquema de expansión urbana de la ciudad de Jaén;;"Los problemas relativos al desarrollo de nuestros asentamientos huma nos tienen como una de las principales causas, el crecimiento explosivo - de la población y concentración en unas pocas ciudades mayores que crecen aceleradamente, ubicadas en su mayor parte en la zona costera del país, en detrimento de un desarrollo urbano rural, nacional, articulado y equilibrado. Esta situación da origen a la formación de asentamiento exponte neos irregulares y no planificados, a carencias y deficiencias de los ser vicios de agua y alcantarillado, a la escasez y precariedad de viviendas y del equipamiento comunal complementario. La situación se agudiza aún más con la falta de vías de comunicación, adecuadas, que cubran las necesidades de articulación y apoyo a la producción. La problemática anterior conlleva a que la actual ocupación del territorio nacional se caracterice por una marcada situación de desequilibrio en lo referente principalmente a la canalización de excedentes económicos, dándose prioridad a los centros urbanos principales, con la consiguiente disminución de posibilidades de desarrollo de las áreas rurales y localidades de menor importancia. Siendo la expansión urbana parte de una política integral de desarrollo, urbano nacional-regional, debe ésta apoyar y garantizar un equilibrio que permita el funcionamiento orgánico del sistema de ciudades y a la vez asegure el aprovechamiento óptimo de sus recursos económicos propios. Urge por lo tanto controlar el uso racional de los recursos y la retención de parte de los excedentes en todas aquellas regiones que como la ciudad de Jaén las produce, a fin de planificar en forma más justa el desarrollo urbano de la ciudad. Uno de los instrumentos legales con que cuenta para aliviar en parte la problemática urbana, consiste en la elaboración de planes y estudios urbanos, pues estos constituyen inicialmente, como ya se dijo, instrumentos eficaces para un armónico desarrollo de los centros poblados - planificando la ubicación de las áreas de vivienda, la localización apropiada de las actividades económicas y de servicios, diseñando una estructura racional para su crecimiento futuro. Como eco de las anomalías anteriormente citadas el Plan Nacional de Desarrollo de mediano plazo (1982-1985) propende como objetivos principales: a) Fortalecer el desarrollo regional a fin de reducir los desequilibrios interregionales, urbano, rurales y el crecimiento explosivo de las ciudades principales (Lima). b) Perfeccionar y consolidar la participación en los procesos de integración y cooperación económico-regional y sub-regional en función de los intereses del País. c) Iniciar las acciones tendientes a lograr un crecimiento poblacional - adecuado, tanto en su estructura como en su distribución y en armonía con el proceso de desarrollo del país (Perú 1982, pág. 374; Mensaje al Congreso del presidente de la República).";Vega Pardo, Rubén Eligio;;Universidad Nacional de Ingeniería;LA Referencia;31/10/1984;es;"urbanization; urban areas; urban planning; land policies; development;";Urban Tenure;"Land Policy & Legislation;Land Use, Management & Investment";PER;Reports & Research;http://www.lareferencia.info/vufind/Record/PE_7432ffa93863256da6c710b6687526fb;http://cybertesis.uni.edu.pe/handle/uni/1964;;CC-BY-NC-ND;info:eu-repo/semantics/openAccess : Open Access, this refers to access without restrictions, and without financial incentives. Access to the resource is gained directly, without any obstacles.;
LaReferencia:CR_da58b28146b138e892ab9b9ab977f85f;Management of urban voids: context, case and propositions.;;The purpose of this review article is to discuss a broaden notion of urban void, in the context of urban sprawl and the urgent need for sustainable land management. To draw a picture about the topic of urban voids, this essay has been divided into two sections. The first part presents a number of concepts that justify a global response of reclaiming urban voids. The second section contains a compilation of case studies of urban void management, whose viability has been possible because innovative urban legislation tools. In the Costa Rican context, where the little discussion about urban voids remain housed in negative urban imaginary, it is important to make visible experiences where its negative meaning has been overcome.;Montes, Ana Paula;;Universidad de Costa Rica;LA Referencia;29/11/2016;es;"urban areas; urban planning;";Urban Tenure;Land Use, Management & Investment;COSTA RICA;Journal Articles & Books;http://www.lareferencia.info/vufind/Record/CR_da58b28146b138e892ab9b9ab977f85f;https://revistas.ucr.ac.cr/index.php/revistarquis/article/view/27146;;CC-BY-NC-ND;info:eu-repo/semantics/openAccess : Open Access, this refers to access without restrictions, and without financial incentives. Access to the resource is gained directly, without any obstacles.;
LaReferencia:CL_1767f0dbf44dc529913aa3abc1fb5336;Subcontratación en el sector forestal maderero chileno e impacto del manejo forestal sustentable implementado en empresa mandante sobre el clima organizacional: Un estudio de caso;;Las exigencias en la industria forestal están enfocadas a alcanzar estándares de productividad y un desempeño socialmente responsable con las comunidades, trabajadores y empresas contratistas. Al igual que en otros sectores, ha habido una importante especialización funcional que ha llevado a las grandes empresas a externalizar parte de sus procesos de la cadena productiva, generando importantes vínculos con empresas contratistas, quienes deben cumplir nuevos estándares internacionales. Es por ello que estas últimas deben preocuparse de generar las condiciones adecuadas para sus trabajadores y su productividad, donde la implementación de un estándar de manejo forestal sustentable podría incidir en cambios organizacionales en una empresa. Esta investigación recoge el caso de una empresa contratista de servicios forestales que concentra sus operaciones en la Región del Bío-Bío en Chile, aplicando una herramienta de diagnóstico de clima organizacional mediante encuestas al personal de faena, la que mide las percepciones que tienen los individuos de su lugar de trabajo bajo el enfoque de Koys y Decottis (1991) adaptado en la investigación realizada por Chiang et al. (2010). Con un Alpha de Cronbach de 0,80, destaca que la percepción de los encuestados en promedio como bueno (De acuerdo) y se ubica en 3,86 puntos. A su vez, se evidencia un número importante de respuestas, lo cual abre un debate sobre los factores consultados. Por tanto, el clima organizacional constituye una más de las dimensiones que está afectando los procesos de certificación, especialmente la incidencia de las empresas contratistas sobre las mandantes.;"Améstica-Rivas,Luis

Moya Lara,César

Salazar Botello,Mauricio

Acuña Hormazábal,Álvaro";;Fundación Científica y Tecnológica. Asociación Chilena de Seguridad;LA Referencia;01/01/2016;es;"natural resources management; forest management plans; forest land; forest conservation; sustainable development;";"Land, Climate change & Environment;Forest Tenure;Socio-Economic & Institutional Context";Land Use, Management & Investment;CHL;Journal Articles & Books;http://www.lareferencia.info/vufind/Record/CL_1767f0dbf44dc529913aa3abc1fb5336;https://scielo.conicyt.cl/scielo.php?script=sci_arttext&pid=S0718-24492016000100002;;;info:eu-repo/semantics/openAccess : Open Access, this refers to access without restrictions, and without financial incentives. Access to the resource is gained directly, without any obstacles.;
